1,@julianHjessop Too late. No one in EU wanna AZN vaccine )
132,READ MORE HERE: https://t.co/m7YhiylDYs https://t.co/9BpyexdozE
133,"@stvyellowstone @AndrewRising4 @2LarryJohnson7 According to who? 

The variants are all still similar enough genetically that antibodies from whatever variant your vaccine was based upon will still be effective. That's why these are called variants, not strains, or species."
134,The Truth About 'Vaccine Passports' https://t.co/64dzrz40qH
135,"@TuckerCarlson look at what @US_FDA is ignoring!

According to J&amp;J's COVID-19 vaccine data presented to FDA, natural Immunity against COVID-19 is as protective, if not more so, than vaccine immunity.

@DrWoodcockFDA I know you see the problem. Fix it!

https://t.co/QFftCcMibG"
136,The vaccine is not mandatory. Why are perfectly healthy people signing up to take it?
137,When I got the vaccine they asked me how I was feeling and I said I feel kind of updog and they put the syringe back in and took the vaccine out of me
138,If China can build a hospital in few day. Why they can’t manage the return of intl students. If China can give millions of vaccine to other countries. Why can’t vaccinate these few thousands students if China can allow businessmen. Y can’t allow intl students #TakeUsBackToChina
139,My second vaccine shot!!  Grateful to all doctors...nurses...paramedics....veterans and volunteers who are vaccinating America! Over 4 million now daily thanks to @WhiteHouse leadership! Still I will wear a mask &amp; social distance until we are all safe...We can do it people!  https://t.co/itdwQQZnE2
140," BREAKING: UK vaccine regulator data shows over one in a million chance of dying from blood clot after AZ vaccine

CONTEXT: Chance of being struck by lightening - 1 in 500,000"
141,"Why Different Vaccine’s Efficacy Cannot be Compared Against Each Other?

They have different:
Mechanisms of action, levels of data published

Were tested in different:
Countries, times, prevalence of variants

ABOVE ALL, no head to head trials

So. Take whichever is available https://t.co/9XgOY1qI3q"
142,"Who, amongst our politicians, is this post COVID_19 vaccine?

... https://t.co/JS9XpNw4Cq"
143,It is April 7- all North Carolinians 16 and older are now eligible for a COVID-19 vaccine
144,"Covid cases increasing
Covid vaccine supplies available

Demand exists but supplies controlled by GoI. 

Shouldn’t Hon. Health Minister reconsider stance of not making vaccines easily available to citizens? https://t.co/mPTIhWjr0M"
145,"Read Donald Lee @ATD4thWorld @ATDIntPresident's message on #WHD2021! ""Beyond shameful inequalities in vaccine availability, we must start now to address more fundamental health &amp; social #inequalities that plague our societies."" https://t.co/dlb0eK9Hnm #HealthEquity #SocialRights https://t.co/GgaW025yHX"
146,"While California was initially slow with vaccine distribution today the state has administered over 20,000,000 doses exceeding France and Germany. A coordinated effort involving a complex operation and a lot of supplies is finding success. We’re near the end of this chapter."
147,"India has surpassed both US and Brazil to bag the number one position with regard to highest new cases, daily. One in seven new cases across the world is that of an Indian.

Despite this fact Modi govt isn't making vaccine available to everyone, Why?

#VaccinateEveryIndian https://t.co/KLdlcU6f5H"
148,"4/
and look what I found on that website (see link in tweet 3/)
- under: Planning guidance for administration of COVID-19 vaccine https://t.co/8c5npjacTx"
149,@nicole_in_AB Their predictions don’t mean shit. They change them no matter what. It’s all about mass immunization with a vaccine that’s questionable at best for a virus that kills elderly and sick people.
150,"Just in.
https://t.co/68paGMMWBA"
151,"Healthy young people in no need of coerced medical treatment told to get the mRNA injection. Hmmm?
https://t.co/cD4TWmahoR"
152,The Only Person I Trust To Give Me My Vaccine https://t.co/8AuH2T9bQq
153,The vaccine is our ticket back to the things we love. The best one to get is the very first one that’s available to you. #RollUpYourSleevesMN https://t.co/fRobVPb5bR
154,"The concept of a vaccine passport is an abomination. No advocate for liberal democracy should support it.

My first piece for the @brussels_report.
https://t.co/k3JbEFoQpq"
155,"People will be like “I’m not getting the vaccine, who knows what’s in it” and then eat hot dogs"
156,@TheLocalSwitz All about trusting a vaccine created in months.
157,"@AurelianoStingi 77% of all covid-19 deaths in the UK were 85 years or older, nearly all had serious underlying health issues and quite frankly a very limited life expentancy.

Weighing up to young healthy people dying from a vaccine should NEVER equate to beneficial!"
158,"@ithinkofdevilz You like when a doctor comes in, lifts up your shoulder sleeve and shoves his big long hard needle and injects you with his vaccine that prevents you from catching a fatal virus, huh? https://t.co/7Ex8gSIiw1"
159,"Trump’s vaccine.

Trump’s wall.

Biden’s dementia.

That’s what we got so far..."
160,"Vaccine appointments available at Walgreens Saint Louis on Apr 9. Sign up here, zip code 63129:
https://t.co/z7hLZHrEAo (as of 9:57)"
161,Is it still the Oxford vaccine or is it the AstraZeneca vaccine now?
162,"I won't be complying with vaccine/health passports and I urge everyone else to boycott this. Its disgusting how people are treated in Israel. This should not be repeated in the UK. It has a 1930s feel to it. 

#NoVaccinePassports 
#NoVaccinePassports https://t.co/owFNNy4xNd"
163,"AstraZeneca's coronavirus vaccine plausibly linked to rare brain clots, European regulators say https://t.co/sqMfT8p7Ms"
164,@claire_foss @ThatRyanChap @TheGazmanRants Partly what is your risk of getting Covid-19 while waiting to get a different opinion.   Also remember most other vaccine don't have the same level of large scale usage to detect uncommon risks.
165,"Trump’s vaccine.

Trump’s wall.

Biden’s dementia.

That’s what we got so far..."
166,@AHS_media Yay...can’t wait for my vaccine https://t.co/fxFHqkgYxG
167,BREAKING: The Oxford/AstraZeneca vaccine will no longer be offered to 18 to 29-year-olds in the UK following reports of rare blood clots in adults https://t.co/816s6tDOeO
168,"Prioritizing education workers to receive a COVID vaccine now, along w/ other essential workers, will provide certainty for Ontario parents. The back &amp; forth pivots from in-person to virtual learning can stop if ed workers have the vaccine.  @ETFOeducators #onted"
169,Maine gets $18M from feds to address racial vaccine disparities https://t.co/WK6jW1UbTq
170,The Only Person I Trust To Give Me My Vaccine https://t.co/8AuH2T9bQq
171,"your immune system.

your immune system after the first vaccine dose.

your immune system after the second dose.

your immune system when covid shows up. https://t.co/dmrEiY3g9A"
172,"AstraZeneca vaccine: MHRA issue new guidance with 18-29 year olds no longer being offered jab

https://t.co/lMeavtMyni"
173,"What’s the brouhaha over vaccine passports?

We’ve used them for decades to prevent infectious disease - it isn’t an assault on your freedom.

Vaccination proof, accredited internationally, is required to travel to many countries for: Yellow Fever, Polio, Meningitis, &amp; COVID19"
174,"According to today's data from the #CDC we only know the race of 57.4 % of the more than 36 million  people that are fully vaccinated. With limited data, it is clear white people are getting vaccinate at a disproportionate rate. Read my thoughts here. https://t.co/bAATfDTr3w"
175,"@GabbbarSingh @heart2eyed I believe Covaxin is the BJP vaccine, but Covidshield isn't, could have taken that naa?"
176,"As some people know, I've spent the last few months getting vaccine appointments for LA people and I figured it's a good time to share what I've learned and try to demystify this needlessly complicated process so that we can all get as many people vaccinated as possible. (thread)"
177,"The public are against vaccine passports.
Industry is against vaccine passports.

There is literally no one except a handful of notable fascists calling for this.

So one must ask, where is the apparent “political pressure” coming from? Who is our government really answerable to?"
178,"While Rahul Gandhi spreads propaganda and media plays Nero’s Guest.. here is what vaccine prioritization works 

https://t.co/e7GGjTKqoW https://t.co/p2cRvqZ46x"
179,The vaccine is not mandatory. Why are perfectly healthy people signing up to take it?
180,"Learn more in a recent gasworld article about how Cold Jet continues to support the distribution of COVID-19 vaccines.

Read more: https://t.co/AlBclg2pbm"
181,"Van Tam taking questions from the media...
Several questions about vaccine confidence.

Of course that’s important, very.... but you can’t help but think the media want a catastrophe to occur for the vaccine rollout.

What better stick to bash AstraZeneca."
182,When I got the vaccine they asked me how I was feeling and I said I feel kind of updog and they put the syringe back in and took the vaccine out of me
183,@SuzeQKnits How is the vaccine holding up against them? So sorry that you are having to deal with all of this but glad you are there for these folks! 
184,The vaccine is not mandatory. Why are perfectly healthy people signing up to take it?
185,"I also don’t want to make this post about me. I’m sharing this story in hopes that others who are hesitant would think twice, talk to people they trust that understand science and get the vaccine when they can"
186,Team DeSantis: Biden White House Pushing ‘Intentionally False Narrative‘ on Vaccine Distribution https://t.co/9DYfGzunoI via @BreitbartNews
187,"You can still do the right thing, remove the restriction and let others to freely import vaccine!! #โควิด19 #โควิด https://t.co/SyxGymRnju"
188,"Read Donald Lee @ATD4thWorld @ATDIntPresident's message on #WHD2021! ""Beyond shameful inequalities in vaccine availability, we must start now to address more fundamental health &amp; social #inequalities that plague our societies."" https://t.co/dlb0eK9Hnm #HealthEquity #SocialRights https://t.co/GgaW025yHX"
189,"CDC asks Walgreens to give Pfizer vaccine doses three weeks apart, not four!  

In NACI pushes to 4months.   3.4 months more than Pfizer protocol. 

 protecting their citizens.   protecting Justin’s numbers!   

https://t.co/w4QPnKGR7r"
190,Immediate side effect of CoVid vaccine= happy tears!!! Thanks again @wolsteincenter @NationalGuard proud to be in Cleveland to end this pandemic!
191,"Captain of Calm, Professor Van Tam in charge of the AZ vaccine press conference. He’s a no nonsense, straight talking guy and I trust him #JVT"
192,What’s it like to want open borders and also vaccine passports?
193,"Why are Conservatives pushing vaccine passports when it is clear they are an attack on our liberties?

Great to see Texas has banned them 

https://t.co/N9bbUws7F5"
194,"RG warned about Demonetization he was ignored.

RG warned about GST he was ignored.

RG shouted about #RafaleScam he was ignored.

RG warned about Covid in Feb 2019 he was ignored.

RG warned about Vaccine strategy and here we are today, with Maha shortage of vaccines. https://t.co/PjwtZIadqn"
195,"Our graphics to illustrate the potential benefits and potential harms of the AstraZeneca vaccine as announced by the MHRA this afternoon.

Benefits accrued over 16 weeks, at three different levels of exposure to the virus. https://t.co/awB80xes3m"
196,"It shouldn’t have taken public shaming to reverse the policy decision to remove Black and racialized people from phase 2 of the vaccine rollout. 

This is why equity is a process and not an outcome."
197,@ClarkeMicah @MailOnline The covid-19 vaccine is a experimental vaccine put out for emergency purposes so it doesn’t have to go through the F.D.A. safety trials and testing for a virus that has a 99.97% recovery rate and the vaccine is 94% effective against the COVID-19 virus! The vaccine doesn’t add up
198,"MHRA AstraZeneca vaccine advice:

Pregnant women should discuss the risk and benefits with a doctor.

People with history of blood disorders should only have the jab when benefits outweigh risks.

Anyone who has had clots should not have second dose.

https://t.co/WIsLu10Zrg https://t.co/s1dn2SSfwz"
199,"@PaulBrandITV Is it now?
Only just few weeks or days ago it was the spiteful 
EU bashing our ""world beating"" vaccine.
How the minds change in just few days.
There, have a flag.."
200,"EMA’s safety committee (#PRAC) has concluded its review of very rare cases of unusual blood clots with AstraZeneca #COVID19 vaccine. 
https://t.co/WGsfRP8PTo https://t.co/aeyzK3bfxd"
201,"“We requested an interview w DeSantis, he declined,""the spokesperson said in a statement .”We spoke to Jared Moskowitz2x,but he declined to be interviewed on camera for our story until after our deadline. The idea we ignored their perspective is untrue.""

https://t.co/OeHx7I9q8V"
202,"This feature from @mcsquared96 on the state of things for people who have gotten the vaccine is so helpful and level-headed. And these illustrations are incredible!

https://t.co/kxqhJ5Xg9Z https://t.co/oYfe9Bmc02"
203,"Backstory: I was consulted on this decision by the Americans.  

They believe Canada delaying vaccine doses by 4 months is cheating.  They see Canada teeming with variants and cutting corners on vaccination—and they are right.  

I agree with the US decision. https://t.co/bdurll8JXU"
204,"Lockdowns, mask mandates, and proposed vaccine passports have never been about containing the virus. 

They’re a strategic power play by the far left to gain more control."
205,"We have updated our information about the Oxford/AstraZeneca COVID-19 vaccine. 

The @MHRAgovuk is carrying out a detailed review of reports of a blood clotting problem affecting a small number of people. 

Info 
https://t.co/CBC8Ru9r2l"
206,If you're unclear on the AZ vaccine this 15 minute summary will clear it all up https://t.co/25n5CPX5xz
207,"During the past few weeks, confused information are emerging as first no such cases were detected in UK (conversely to what EU countries were pointing out), then only few cases over a vaccine roll-out worth million of doses and today during the press conference 79 cases are https://t.co/c9NN6uuuO3"
208,#YORKTON AstraZeneca Covid Vaccine Drive-Thru Clinic today. Age 55+. 8:30AM-6PM at St. Mary’s Cultural Centre. Short wait times currently.
209,"Seriously? 

“Man you got biceps as big as my thigh,” Biden chuckled.

Biden Breaks Social Distancing Guidelines at Vaccine Center https://t.co/xw3CmG598Z"
210,"Distributing COVID-19 vaccines presents complex challenges.

This #WorldHealthDay, learn how our technology helps facilitate their delivery: https://t.co/8NA80RNjka https://t.co/tzwNfANqbk"
211,Just got my second dose for the Covid vaccine. I chose to be part of the solution. https://t.co/QaNPO0ztig
212,"looking forward to making my friends compete in my very own vaccine olympics in the future and finding out who is hottest: pfizer, moderna, or j&amp;j"
213,Then you must also inform them that Maharashtra is vaccinating nearly 5 lakh a day and 10 lakh of stock means two days of vaccine. 7.5 lakh in pipeline is 1.5 day requirement. So this isn’t a reply but an apology from them. https://t.co/G4E03DUEh4
214,When its 2024 and you are the only one who didn't take the covid vaccine https://t.co/NbX5pxOh4Y
215,@ShazadAkbar @Xadeejournalist @ImranKhanPTI Now the government should go to High Court to fix the vaccine price at Rs1400  for private use.
216,"So after @rajeshtope11 tells @IndiaToday that Maharashtra is facing a vaccine shortage, union health min @drharshvardhan hits back, says no vaccine shortage, blames state govt instead. The last thing we now need is a centre state fight over vaccines!"
217,"Pres. Biden: ""The virus is spreading because we have too many people who see the end in sight, think we're at the finish line.""

""Let me be deadly earnest with you: we aren't at the finish line...We're still in a life and death race against this virus."" https://t.co/2AIn67dXzZ https://t.co/n1xBTBDZbw"
218,"The chance of getting blood clots after the AstraZeneca vaccine are about the same, according to some estimates, as the chance of getting struck by lightning over the course of a year and a bit. In other words, extremely, extremely low."
219,"""Some people who have spent months suffering from long-haul covid-19 are taking to social media to report their delight at seeing their symptoms disappear after their vaccinations, leaving experts chasing yet another puzzling clinical development.""

https://t.co/qUQ4NnjAUI"
220,"People who have had the vaccine are so keen to force others to have the vaccine because if it later turns out that they have screwed up by getting it then at least you have too.

They don't want to look dumb on their own."
221,"Today Show Anchors Get the COVID-19 Vaccine on Air: 'What a Privilege,' Says Savannah Guthrie​  https://t.co/i0PJKx6x4R"
222,"Rare clots possibly linked to AstraZeneca #COVID19 vaccine, EU agency says https://t.co/rYuSDmDaEZ"
223,U.K. Limits AstraZeneca Vaccine to Over-30s Amid Blood-Clot Concerns https://t.co/jstoo42atP
224,"Don't worry: COVID vaccine skin reactions aren't dangerous, this study says. https://t.co/5fQyn8Xknc"
225,"The vaccine was always going to do vastly more good than harm. Covid-19 kills 1 in 150 of those infected. These rare blood clots, even if they really are caused by the vaccines, affect one in every 600,000"
226,"Scooplet: Biden's administration will announce today that vaccines are now available to all Community Health Centers nationwide.

It pushes the total to 1,470 CHCs, from 950. Patients are largely racial and ethnic minorities; the program is aimed at closing the vaccine race gap."
227,"#Covid19 soo - the benefit of using AZ vaccine outweighs the harm - got that.

Q is - why is the UK so reliant on the AZ jab when others are more effective/ have fewer complications?

Did UK gov favour #AstraZeneca because ... it’s “British”?!"
228,"White Evangelical Resistance Is Obstacle in Vaccination Effort https://t.co/GpgzzSuqsB #bospoli #mapoli 

Matching signs is sometimes an indicator that the group is astroturf, I.E. all the out-of-state and in-state millionaire and billionaire donors to privatize MA public schools https://t.co/lbejicMlVw"
229,"McConnell in Lexington, KY today: ""I saw on some program last week that Republican men, curiously enough, might be reluctant to take the (COVID-19) vaccine. I'm a Republican man and I want to say to everyone, we need to take this vaccine. These reservations need to be put aside."""
230,Worried about getting one of the “good” vaccines? Here’s one doctor with a great explanation on why the best vaccine is the one you can get now https://t.co/3n0Bi5VFLh
231,To be fair to the vaccine very few things in Britain work for the under 30s
232,"Trump’s vaccine.

Trump’s wall.

Biden’s dementia.

That’s what we got so far..."
233,"To our construction guild and citizens in general we say that: To learn more or to find out where to get vaccinated, visit https://t.co/59wOb0qZXh
protect and support others#newyorkcitylife #newyorkers #vaccine #06abril #constructionlife #homeremodeling #work #safety https://t.co/8f9Ytky2C5"
234,"From UK Govt presentation on the AstraZeneca vaccine: when virus prevalence is low (lower than current UK numbers) the balance of risk under-30s between Covid and the vaccine is about even over a 16-week period. For 30+, the vaccine wins hands down. https://t.co/FF4Wqse6sQ"
235,"Trump and Biden officials knew about quality-control problems at the Baltimore facility that ruined 15 million COVID-19 vaccine doses, report says https://t.co/lIQvqTmCgG no it is all jackass Joe's fault he did it on perpuse"
236,@sturdyAlex BBC seem to have dropped the Oxford moniker on the AZ vaccine
237,"@FionaRedFM @RedFMNews @CorksRedFM If I go and get me vaccine, who will sign to take responsibility if something happens me from the vaccine??????"
238,"Today’s announcement from the Ford government absolutely must come with protections for those who can’t stay at home.

Vaccines for essential workers, paid sick days, and on-site testing and vaccine clinics are vital tools to finally break the cycle of rising cases and lockdowns."
239,"Maharashtra Govt should not play politics over vaccination. Here are the facts: Total number of COVID vaccine supplied to State till date
- 1,06,19,190 ; 
Consumption - 90,53,523 (of which 6% wastage - over 5L) 
Vaccine in pipeline - 7,43,280. Dosage available - nearly 23 lakhs"
240,#COVIDvaccine please urgently someone explain have we now got 20 million people in the UK now at an increased risk of blood clots for their entire life as a result of the AZ vaccine???
241,"@DanielOram98 Proud we’ve made a vaccine and trust it more than others out there, but wish I waited a few days now lol"
242,most useful takeaway from vaccine side effects announcement (super rare as they are) is the symptoms to look out for which are here https://t.co/6tadnkFqOT
243,Seeing the result of the consultation on the AZ vaccine inquirer the idea of implementing vaccine passports as a way of manipulating young people to get the vaxx is immoral.
244,"The vaccine was always going to do vastly more good than harm. Covid-19 kills 1 in 150 of those infected. These rare blood clots, even if they really are caused by the vaccines, affect one in every 600,000"
245,"PSA: You can register for your COVID vaccine this morning and get your shot by the end of the day in St. Louis!
FEMA can vaccinate 3000 people a day at America's Center. Just 500 people have signed up today. I have details at 6/6:30 on @ksdknews https://t.co/9Dl0IioS8r"
246,"The EMA’s safety committee, which was assessing the vaccine, has requested for more studies and changes to the current ones to get more information."
247,"Read Donald Lee @ATD4thWorld @ATDIntPresident's message on #WHD2021! ""Beyond shameful inequalities in vaccine availability, we must start now to address more fundamental health &amp; social #inequalities that plague our societies."" https://t.co/dlb0eK9Hnm #HealthEquity #SocialRights https://t.co/GgaW025yHX"
248,This press conference is not highlighting how the AZ vaccine is dangerous to under 30s. It is highlighting how Covid is not dangerous to under 30s.
249,"@only_nikhil_ No bro... Most of the Indians pay tax directly or indirectly , but that doesn't mean non tax payers should be devoid of vaccine... Labourers , farmers don't get compensation as per their hard work. Being a socialist country, India can't be unfair to them."
250,worry about the vaccine registration first how bout that https://t.co/2duPEcc7Pm
251,When I got the vaccine they asked me how I was feeling and I said I feel kind of updog and they put the syringe back in and took the vaccine out of me
252,"So at the moment two vaccinated people cannot meet indoors as the vaccine doesn’t stop transmission.
Ok but in a few weeks they are saying hundreds of people can meet indoors at a concert if they have a vaccine passport.

Ok."
253,"Trump’s vaccine.

Trump’s wall.

Biden’s dementia.

That’s what we got so far..."
254,No one with an IQ above room temperature thinks the vaccine passport will be limited to *this* one. We all know it’ll be booster shots and new shots and more more more because slippery slopes are real.
255,"The clinics will be held on Saturday, April 10 and Saturday, April 17. https://t.co/uWek7qdlPa"
256,U.K. Limits AstraZeneca Covid-19 Vaccine to Over-30s Amid Blood-Clot Concerns  https://t.co/kwyYzatYxN
257,Not in Georgia! https://t.co/s05L02xGQL
258,Almost 4 million vaccine deliveries expected before July as booking portal opens in two weeks https://t.co/xOhKscfYcd
259,"Everyone is talking about the vaccine, masks, social distancing etc, but no one is talking about vitamin d deficiency, zinc, ivermectin, staying fit, reducing obesity or anything else that would improve your chances of recovering from COVID outside of those things. It’s so odd."
260,"“Our conclusion is that these clotting disorders are very rare side effects of the vaccine”, says Straus. ""The currently available data did not allow us to identify a definite cause for these complications."""
261,"And the slide based on 'high exposure risk' ie the level of covid seen in UK at peak of second wave.

Conclusion: in a serious outbreak the vaccine is very beneficial for everyone, but when infection rates fall to very low levels then the risks may outweigh benefits for youngest. https://t.co/Ihx52NIHHm"
262,@SimmiAhuja_ Is the vaccine really effective?
263,"It is also a blow to AstraZeneca, which was a frontrunner in the race for making an effective vaccine against COVID-19 ever since it began working with the University of Oxford."
264,"Do you know that there are fewer than 10 #African manufacturers with #COVID19 vaccine production capabilities and all are based in five African countries?
They are - #Egypt, #Morocco, #Senegal, #SouthAfrica and #Tunisia

Source: @WHO 

#WorldHealthDay @NTikum @UNDPAfrica https://t.co/JTplNKc5BR"
265,"It's time to #VaxUpUPIKE!
This Friday, April 9, from 10 a.m. - 6 p.m., free COVID-19 vaccines will be offered on Benefactor’s Plaza.
@pmcpikeville  will be administering the Pfizer Vaccine for all members of the UPIKE community. https://t.co/sw94X2GRbR"
266,"Lockdowns, mask mandates, and proposed vaccine passports have never been about containing the virus. 

They’re a strategic power play by the far left to gain more control."
267,9-year-old girl wanted to buy her grandma a vaccine just so they could hug https://t.co/N79kpDORg8 via @CTVLondon
