1,@julianHjessop Too late. No one in EU wanna AZN vaccine )
2,"THIS IS NOT OKAY. The virus is not under control and workers are at risk RIGHT NOW. (AND there's the possibility of a vaccine-resistant strain of the virus.)  Essential workers are getting us through this crisis, and are depending on you. NO DELAYS. https://t.co/fUQ9GgP4Bc"
3,"Everyone is talking about the vaccine, masks, social distancing etc, but no one is talking about vitamin d deficiency, zinc, ivermectin, staying fit, reducing obesity or anything else that would improve your chances of recovering from COVID outside of those things. It’s so odd."
4,"Sing it with me!
 Oh, happy day!
Oh, happy day!
I got the shot!
Shot 1's in my arm! 
#vaccinated #modernavaccine #Vaccine #CovidVaccines #ImNotThrowingAwayMyShot #ThankYouScience https://t.co/W38PpPKXIf"
5,"""Vaccine may not be suitable for young women""
+
""Under 30s should be offered alternative""
=
FMLLLLLL AM CONFIRMEDLY *OLD*"
6,I do NOT support a vaccine passport and have no intention of implementing one in the State of Missouri.
7,"F.A.S.C.I.N.A.T.I.N.G Video:

Real Purpose of COVID Vaccine https://t.co/2Gy5AsbdTL"
8,"When the polio vaccine dropped in 1955 people lined up to get it, &amp; we were 2 years away from artificial satellites. Now in 2021 we carry external world-brains in our pockets &amp; there’s robots on Mars and idiots think the COVID vaccine is full of wizard poison."
9,"4 in a million chance of clotting with the AZ vaccine.

About the same odds as you reading this getting killed by a shark."
10,"Man who thinks Canada should get tough on China, laments that several very small countries using China’s vaccine diplomacy are ahead of Canada. Is @erinotoole pro-China now, or is he calling out Doug Ford and Jason Kenney for not being as good at vaccinating as Seychelles? https://t.co/B8IwrBd1oI"
11,EMA: Has not yet reached a conclusion on AstraZeneca COVID-19 vaccine | World English News | WION https://t.co/JpcytCC2gv
12,The United Kingdom's drug regulator says the AstraZeneca vaccine has huge benefits but people under 30 will be offered another product due to a rare blood clot risk. https://t.co/iRVSuJ14hw
13,"If you’re a republican in office and you’re not vocally and aggressively opposing “vaccine passports” it may be time to find another career. 

This concept could be the greatest affront on our freedoms in recent history and if you don’t see that it’s a problem."
14,"Trump’s vaccine.

Trump’s wall.

Biden’s dementia.

That’s what we got so far..."
15,A close acquaintance of mine died from COVID on Sunday. What saddens me about her death is that she was offered the vaccine but refused because she wanted to see how others reacted.
16,"@WalterRothbard Think about the etymology of “vaccine”: from a Latin word having to do with cows (from the specific medical procedure leading to its invention). Making the term generic might help the PR campaign, but abandoning language to state apparatchiks seems foolish to me."
17,"Everyone is talking about the vaccine, masks, social distancing etc, but no one is talking about vitamin d deficiency, zinc, ivermectin, staying fit, reducing obesity or anything else that would improve your chances of recovering from COVID outside of those things. It’s so odd."
18,Okay Asunción let them know the benefits of the vaccine immunization passport #TheView
19,"President Obama gave Moderna $25 million in 2013 to develop mRNA vaccine technology. 

Which helped get us Covid 19 vaccinations in a pandemic. 

And now may get  us HIV vaccinations. 

Moral of the story: fund science,  elect Democrats up and down the ballot, and Thank Obama."
20,UK to offer non-AstraZeneca Covid-19 vaccine to under-30s over blood-clot link https://t.co/84hN4diKc0
21,"1 person dies in Kenya after taking AstraZeneca Covid-19 vaccine. 279 had adverse effects and 7 others were severe, Pharmacy and Poisons board says"
22,"India just recorded its biggest jump in new coronavirus infections since the pandemic began.

It comes as the world's biggest vaccine maker — located in India — said it was ""very stressed"" and needed government help to boost production.
https://t.co/3fOYmuMWE8"
23,"The public are against vaccine passports.
Industry is against vaccine passports.

There is literally no one except a handful of notable fascists calling for this.

So one must ask, where is the apparent “political pressure” coming from? Who is our government really answerable to?"
24,"NOW OPEN: We just opened 1,200 new appointment slots for #Moderna #COVID19 vaccine at Rodeo Reed Road Parking on April 10. #TakeYourBestShot to end this pandemic by registering NOW at https://t.co/56lmp1SQBo. #HouNews https://t.co/JUsEGs9PXR"
25,"I preferred it when Politics for All was sharing sensationalised content about the inner life of political parties, not essentially inaccurate stuff about who gets what vaccine."
26,"#COVID19 vaccine supply to Maharashtra Govt so far:
Already supplied - 1,06,19,190
In the pipeline - 7,43,280
Consumption - 90,53,523

Supply of vaccine is NOT the issue. It is only an excuse to divert attention from the absolute failure of Maharashtra govt to control COVID."
27,"Peace of mind is the ultimate food, shelter, medicine and vaccine.
I found the following that keeps a man at peace.
Best wishes at World Health Day https://t.co/l6L6CtuUpE"
28,When I got the vaccine they asked me how I was feeling and I said I feel kind of updog and they put the syringe back in and took the vaccine out of me
29,"@jbf1755 FYI, University of California statewide vaccine requirements from 2020. They'd had some version of this for decades. No vaccines means admission on hold until a Medical Exemption is approved. I fully expect Covid will get added to the list of mandatory vaccines. https://t.co/2V95vTfqEG"
30,"BREAK: Bavaria has negotiated 'preliminary contract' for 2.5 million doses of Russia's Sputnik V #vaccine 
https://t.co/T1ISpsCFZQ"
31,Uk can keep that bullshit vaccine over there
32,You know how you go to get the vaccine and no one asks for money and you aren’t worried about how much you’ll have to pay? Now imagine all healthcare was delivered like that.
33,The vaccine is not mandatory. Why are perfectly healthy people signing up to take it?
34,"Breaking—Adults under age 30 are to be offered an alternative #COVIDvaccine to the AstraZeneca vaccine due to mounting evidence linking it to rare blood clots, the UK's vaccine advisory body says. #covid19
 https://t.co/AqVppwiK5D"
35,"'We need people all around the country saying NO!'

If I don't do something, I wont be able to sleep at night knowing that in 6 months time when we are all scanning our vaccine passports to get into Sainsburys, I didn't try to do something. https://t.co/wg2jyZ4pr4"
36,"Scooplet: Biden's administration will announce today that vaccines are now available to all Community Health Centers nationwide.

It pushes the total to 1,470 CHCs, from 950. Patients are largely racial and ethnic minorities; the program is aimed at closing the vaccine race gap."
37,"""The benefits of the AstraZeneca vaccine against #COVID19 continues to outweigh the risks for the vast majority of people.""

MHRA chief executive Dr June Raine says the benefits for older people are great, but is ""more finely balanced"" for younger people.

https://t.co/tEhQi0lYdc https://t.co/pewJXhCkcY"
38,Imagine if the world was as concerned about blood clots from the pill as they are with the Covid vaccine  #AstraZeneca
39,"NEW: Fox News obtained emails sent between “60 Minutes” &amp; DeSantis’ office, who urged CBS to interview FL Dem Jared Moskowitz abt the vaccine rollout. A producer wrote “we appreciate his perspective.”

Moskowitz told them the Publix story was “bullshit.”

https://t.co/Q4ua32Ogh2"
40,"LOOK: Sec Carlito Galvez Jr, NTF against COVID-19 Chief Implementer &amp; Vaccine Czar bared that as of April 6, the govt has confirmed the arrival of 2M doses of anti-COVID 19 vaccines --- 1.5M doses from Sinovac &amp; 500,000 doses from Gamaleya.

Read: https://t.co/t9yAVibzpO https://t.co/ozZuaPlIH8"
41,"Okay, you've got to get all this Oxford-#AstraZeneca stuff into perspective. (1) Shouldn't affect UK vaccine rollout in near term, except extremely marginally as high-risk 20somethings get offered something else."
42,"Thank you @fordnation for announcing that Ontario is moving to Phase Two of the #COVID19 Vaccine Distribution Plan, prioritizing residents 50+ in hotspot communities, like #Peel. Please check the chart below to see if your postal code qualifies you for this early vaccination. https://t.co/luimy2xBiL"
43,"""Our conclusion is that these clotting disorders are very rare side-effects of the vaccine,"" says EMA safety committee chair Sabine Straus.
The cause is unclear, but it's possibly an immune response, EMA said.
The benefits nevertheless outweigh the risks.
https://t.co/MUTw3qPYrq"
44,Professor Jonathan Van-Tam says restricting the AstraZeneca vaccine to over 30s should a 'zero or negligible' impact on the UK's vaccination timetable - but is contingent upon UK receiving alternative jabs like Pfizer and Moderna https://t.co/zPE6Xgxoii https://t.co/dkqayUmnbu
45,"@edosch81 Exactly. If its right for you, do it. Leave everyone else alone regarding an untested vaccine that “may” only prevent symptoms and “may” only work for 6 months....."
46,"Professor Van Tam weighs up the risk:

 He says that older people are less likely to have blood clots, and there is a greater benefit for them to have the vaccine.

 He adds, 'we don't want it to result in a loss of vaccine confidence' urging people to have their second dose"
47,@KEdge23 @MoriartyProfJ3 Which is more of an instance of scaremongering: saying that u30s shouldn't take a vaccine for a virus that are at statistically no risk from; telling the population that they should act as if they were vectors of disease and are at tangible threat from a virus with a 0.15 IFR?
48,The government revealing young people's reward for giving up a year of their lives for others and being slapped with vaccine passports to keep us indoors so boomers feel safe https://t.co/uRBOTnpfBh
49,White House rules out Biden administration supporting vaccine passport system  https://t.co/FabcuHfYtW https://t.co/TbFW5ju6m8
50,BREAKING - Drug regulator of the European Union finds link between #AstraZeneca vaccine and blood clots (Reuters)
51,"#BREAKING: Canada could give 75 per cent of adults their first COVID-19 vaccine dose by mid-June if provinces stretch dosing intervals up to four months, NACI says.

https://t.co/9XioJMbDPa"
52,"While Rahul Gandhi spreads propaganda and media plays Nero’s Guest.. here is what vaccine prioritization works 

https://t.co/e7GGjTKqoW https://t.co/p2cRvqZ46x"
53,Boris Johnson vows to PUSH ON with plans for domestic vaccine passports https://t.co/ncEmisvbmv
54,Under-30s in UK to be offered alternative to Oxford-AstraZeneca Covid vaccine due to rare blood clot risk https://t.co/okgJLWuFXc
55,This covid vaccine research might help us get HIV up outta here too. Oh the things you can do when science is funded well.
56,"This is a great slide.
Worth noting it’s for “low exposure risk”- which might not be the case if we reopen fully with unvaccinated young populations and no precautions.

Blood clots with COVID infection still a higher risk than with vaccine https://t.co/ovdyXZFtpK"
57,The concept of vaccine cards/passports isn’t new. Here’s my vaccine card for yellow fever that let me get into Brazil and back into the US. I promise it’s not as weird or controlling as it’s been made out to be. Just an extra step to get us outta the pandemic sooner and safer https://t.co/YgW11N6nF4
58,"Astra Zeneca has sent legal notice to Serum Inst for delay in vaccine supply. This co has overcommitted to everyone knowing fully well its capacity limits

This is what happens if the govt of a country with 1/6th of world's population banks on just 2 or 3 sources. No wonder ++"
59,@SkyNewsBreak @GMB @BBCBreaking so a bit of a story here about the AstraZeneca vaccine and Pampers @BorisJohnson is no where to be seen. Perhaps he’s busy somewhere else but this is news. Well not very good news after he said it was a non story.
60,Then you must also inform them that Maharashtra is vaccinating nearly 5 lakh a day and 10 lakh of stock means two days of vaccine. 7.5 lakh in pipeline is 1.5 day requirement. So this isn’t a reply but an apology from them. https://t.co/G4E03DUEh4
61,just got my first dose of vaccine omfg https://t.co/jUqM4oAgDj
62,By #Kentucky Senator @RandPaul RT We must resist the latest COVID-era power grab: the 'vaccine passport' https://t.co/PBd3FAkJjd
63,"The govt is using the debate on Vaccine Passports as a smokescreen to cover up the failed Test &amp; Trace system.

If Test, Trace and Isolate worked there wouldn't be a need for domestic Vaccine Passports. Covid status would only be required for travelling outside or entry to the UK"
64,"Covid medicine/vaccine....onion, garlic, ginger, honey...drink it...taken orally...twice a day...1 in the morning and 1 in the evening....immune system alright...nuh mean seh u fi go try get sick...lol I did...3 times....it does work."
65,So we giving in and getting the vaccine I see ?? 
66,"UK media getting very excited about roll out of Moderna Vaccine today, April 7.  No mention that the “slow and cumbersome” EU regulator approved it on Jan 6, or the “incompetent” EU contracts ensured deliveries and use from Jan 12.....1/2"
67,"""I want to start by stating that our safety committee the pharmacovigilance risk assessment committee of the European Medicines Agency has confirmed that the benefits of the AstraZeneca vaccine in preventing #COVID19 overall outweigh the risks of side effects”, says Emer Cooke."
68,"@HuXijin_GT Don't worry Father of Covid19, India will take care of the Whole World , we will supply Vaccine not Virus like U . https://t.co/Y7bOLMbFhl"
69,How to get the vaccine to remote places. https://t.co/CDDSRWsdzp
70,Montana Governor Test Positive for COVID-19 Four Days After Taking Vaccine https://t.co/k3gZzDhlGN via @gatewaypundit
71,"#GujaratCoronaUpdate
#COVID19Dashboard
3575 New cases
2217 Discharged
22 Deaths reported
18684 Active Cases,175 on ventilator
71,86,613 People recieved 1st dose, 
8,74,677 Got 2nd dose of Covid Vaccine
1,48,111 people above 60 and 45-60 got first dose, 20,656 got 2nd dose today https://t.co/aORNPqkceA"
72,BREAKING - Drug regulator of the European Union finds link between #AstraZeneca vaccine and blood clots (Reuters)
73,"@ClodaghSnarks @jjsalmo @katebevan For the under 30s. I can’t believe you waited three weeks to try and claim this as a Pyrrhic victory  Rejoin?  
Didn’t micron take the AZ vaccine? The constant hold up has lead to additional deaths in Europe. But as long as you find that funny  Rejoin "
74,"Everyone is talking about the vaccine, masks, social distancing etc, but no one is talking about vitamin d deficiency, zinc, ivermectin, staying fit, reducing obesity or anything else that would improve your chances of recovering from COVID outside of those things. It’s so odd."
75,Study finds Coronavirus vaccine 50% more effective if selfie is posted on social media after receiving dose
76,"We all know who started that narrative of the chip being in the vaccine. And WHY. 

Same people that coined the term ""conspiracy theorist"" to make critical thinkers look crazy.

The CHIP comes AFTER vaccine passports, when people start forging them.

But go off sis."
77,"By April beginning 32% in USA &amp; 47% in UK got the first dose of the vaccine. 
India was limping at a niggardly 5.2%.
While PM focuses on sermonising, BJP government must be made to discharge it’s responsibility to vaccinate all adults on a war footing. https://t.co/xrump4RRZ5"
78,"With the vaccine being rolled out to all those above 45 years of age, we are now surfacing 8,600+ Vaccination centres across 1,500+ cities.

#GetTheFacts and know more  https://t.co/fJBRdZwDvy. https://t.co/JPgwq3KspR"
79,@HILITINGHOCKEY How exactly are we simultaneously at the back of the line and hoarding vaccine preorders?
80,The absolute absurdity of desperately trying to tie vaccines to Brexit reaches its apotheosis with the U.K. now adopting a more cautious approach to AZ (the vaccine they wanted to adorn with an actual union flag!) than the EU. https://t.co/GHuDjhMane
81,"Why is #DougFord so clearly unable to manage the flood of #Vaccines the feds are supplying to Ontario? 
Isn't his team ready for the pandemic?

#CheckTheFreezerDoug  #COVID19Vaccines 
 https://t.co/2EE4wf0H97"
82,@CBCNews Fuck off with that...just get us the vaccine for now.
83,"The Indian Medical Association urging the government to allow all citizens to receive the vaccine, the BJP government chooses to put people’s lives in danger. 
#VaccinateEveryIndian https://t.co/o4Wuwcu42B"
84,"@Snusketeer @AFP Wait. You’re using U.K. and the EU saying the vaccine is safe as evidence they were right to stop it 

Hmm that’s some funky logic you have going on there"
85,@cccofmn What vaccine is being today (and will you know what it will be tomorrow?)
86,@Soundbuy @jessphillips So what was different about the vaccine trials?
87,"@healdsgreen No, but you have to weigh up which risk is worse to you, COVID or the vaccine etc.  It’s a fine line to walk. I think stopping for under 30s was probably best decision to ensure younger uptake even tho the risk is so minimal"
88,"The European Medicines Agency says blood clots seem to be a very rare side effect of the AstraZeneca vaccine, and not a coincidence. However, incidence is still quite low — and cases of Covid-19, which also causes death, are much higher. https://t.co/YEoYRuBbGe @newrepublic https://t.co/ulEKsu1kqq"
89,"While the Govt  was quick to slap price controls on the vaccine  &amp; also become the company’s sole distributor.

Typical command &amp; control babudom with no responsibility but grab all power. https://t.co/CbQVjMVJFO"
90,ORDINARY PEOPLE HAVE ONE SIGNIFICANT POWER LEFT- BOYCOTT. Vaccine passports are tyrannical. So the logical response is to boycott business that demand them. Various people have suggested this here. I lend this account to the same proposition. #SayNO #BoycottVaccinePassportTyranny
91,"Taking an Aspirin is 50 times more likely to kill you than getting a shot of the AstraZeneca vaccine.
But humans are not wired to understand risk correctly."
92,All those internet conspiracies are right. If you get the vaccine Bill Gates will be able to track you.  https://t.co/fFl9h9SjCg
93,BREAKING - Drug regulator of the European Union finds link between #AstraZeneca vaccine and blood clots (Reuters)
94,BREAKING: Allegations today indicate that the so-called Coronavirus vaccine program is all part of a secret plan to prevent people from getting sick.
95,"Hey hey! If you're having trouble finding a #COVIDvaccine in Mass, follow @vaccinetime. It's a [good] bot that tells you when vaccine spots are available. @assoumou_MD @BhadeliaMD @The_BMC"
96,"As of 8:00 p.m. yesterday, 2,726,221 doses of the COVID-19 vaccine have been administered.
 
Today’s numbers will be available at 10:30 a.m. at https://t.co/ypmgZbVRvn."
97,Thanks to my stepsister @JuziDarden for getting me an even better vaccine appointment!!!!! :o
98,COVID-19 vaccine clinic in Seneca County has openings https://t.co/fLVx1ZvbYg
99,"Under 30s should be offered an alternative coronavirus vaccine to the Oxford/AstraZeneca when an alternative is available, Professor Wei Shen Lim, COVID-19 Chair for JCVI, has said. https://t.co/JIOTS7FhOo"
100,@SenatorTimScott @MLB I just got my second COVID vaccine at a community center in Hartford.  Guess what - photo I’d required.  Hundreds of people - didn’t seem to be a single person that had an issue with that.
101,"So, out of 20 *MILLION* people who’ve had the vaccine, there has been 79 cases of blood clots. 

79 out of 20 MILLION. 
In other words, a 0.0003% chance of a blood clot. 

It’s important to keep things into perspective."
102,Guys help I got the Pfizer vaccine and now my dick won’t stop growing
103,"Did you hear? The UK has launched its biggest mass-vaccination program and ACF Technologies aims to support them with technology capable of scheduling millions per week! Learn more in our press release:
https://t.co/gGJwemUZy5
#COVID19 #Vaccine https://t.co/xgwdY9RhYh"
104,"While Rahul Gandhi spreads propaganda and media plays Nero’s Guest.. here is what vaccine prioritization works 

https://t.co/e7GGjTKqoW https://t.co/p2cRvqZ46x"
105,@KateAndrs Frequent use of paracetamol and ibuprofen is more dangerous than the AZ Covid-19 vaccine.
106,"About a week ago the black woman bagging my groceries, asked how I was doing. I said I just got my first vaccine shot and she said she wasn`t sure about getting it. I said my son worked for the CDC and it would save her life. Today she told me, she got her first shot."
107,"@ABakiera @ItzBenJii11 @BBCBreaking I was young &amp; 100% healthy when I caught a virus in '02.  'Health' can vanish  in an eye's blink as I found out. Nothing I could have done to prevent it, but if there had been a vaccine &amp; I'd known what that  virus would do to me, I'd have jumped at it. I'l never be well again."
108,"@rupasubramanya Let’s just assume, we were being misled on the vaccine stockpiles too, because the it’s difficult to believe the govt didn’t know how many doses we need. 
Today many states seem to have just a day or two worth of vaccine stock."
109,"around 50,000 teachers in Alberta and 400,000 vaccine doses in the freezer. Maybe a blue-ribbon panel to solve this incredibly difficult problem."
110,I just got my COVID vaccine I’m so happy to not die of plague I was quite worried as constitution is my dump stat
111,"There were 169 case of CVST and 53 of splanchnic vein thrombosis reported in 34 million people who received the vaccine in the UK and EEA.
They were largely in women under 60, but this may be because more people in that group were receiving the vaccine, EMA said."
112,"AstraZeneca's Covid-19 vaccine is possibly linked to rare blood clots, according to the European Medicines Agency https://t.co/JjfyoKk7sK https://t.co/O3YgJkBqiv"
113,"Moderna COVID-19 vaccine lasts at least 6 months, study findsI mean really, are we all a bunch of guinea pigs? I’m beginning to think these so called disease specialists have no idea what works or doesn’t works

https://t.co/PJ1YrBQdqv"
114,"So, kind of like.... a vaccine passport? https://t.co/e5wpJVuBxo"
115,Important point being hammered by the MHRA here - Covid-19 is far more likely to cause blood clots than the AZ vaccine
116,"What’s today’s big news – that the AstraZeneca COVID vaccine is still highly safe? We knew that. Or the latest value of the magnetic moment of the #muon, which could hint at new physics? We don’t know that, but we will in about half an hour #gminus2"
117,"@Mariann74754415 @DonaldWelsh16 what i don't understand is what they would really be getting out of it. so much less risky to do like the romans: ""give them bread and circuses"" has so much less risks. the end risks of people rejecting vaccines en masse due to a bad experimental vaccine are so much higher"
118,When I got the vaccine they asked me how I was feeling and I said I feel kind of updog and they put the syringe back in and took the vaccine out of me
119,"Sleeves up! @FLSERT, @HealthyFla and the CDR Vaccine Team are rolling up to a city near you! 
#COVID19Vaccine offered: Johnson &amp; Johnson
No appointments necessary
Vaccinating all #Florida residents 18+
Meet us there! https://t.co/ufLWKHrRRW"
120,BREAKING: The European Union's drug regulator says it has found a “possible link” between the AstraZeneca coronavirus vaccine and a rare clotting disorder but said that the benefits of the shot still outweigh risks. https://t.co/E4ShuGTqzH
121,Tomorrow I get the J&amp;J vaccine. #vaccinate https://t.co/fs6sItwIfk
122,"""Which vaccine did you get"" is the new office convo."
123,"@BenKentish @LBC I had my first AZ jab, alas Pfizer is 100% effective against the S Africa variant that's spreading across Europe &amp; is on the rise in the UK, while Astrazeneca's vaccine is only 10% effective. 18 million+ have had the Astrazeneca jab in the UK: what about the implications of that?"
124,It is April 7- all North Carolinians 16 and older are now eligible for a COVID-19 vaccine
125,drinking until i destroy my body enough to qualify for the vaccine
126,"Maharashtra Govt shouldn't play politics over vaccination. Total number of COVID vaccine supplied to State till date is 1,06,19,190; consumption is 90,53,523(of which 6% wastage-over 5L) 7,43,280 vaccines in pipeline. Nearly 23 lakhs dosage available: Union Min Prakash Javadekar"
127,"Changed my vaccine appt to today.
Gotta get that jab. Now in Brooklyn. I really wanted to see Pelham. Oh well..."
128,"@OutlandishMatt Passport serves all of the rolls of a driver's license plus passport things. You may still need a visa or vaccine records depending on the country, and a driver's license is still necessary if you want to rent a car"
129,"Today, I took my 2nd and final dose of the COVID-19 vaccine #CovishieldVaccine by Serum Institute of India @SerumInstIndia. Kudus to all our doctors, scientists &amp; frontline workers who worked together to fight against COVID-19. Let’s make India COVID-19 free. #staysafe #WearAMask https://t.co/Bo88iWRBHy"
130,Just got that Johnson and Johnson vaccine if I turn into a zombie I'm bitin all you mafuckas 
131,"What is the incentive to take any vaccine if we can’t get back to leading a normal life?
Why are government officials still collecting a full salary while many are unemployed and facing hardships due to these continuous lockdowns? https://t.co/P4F2H1yTLf"
