LABEL,TEXT
FALSE, storybud - please take some time to find out about it before you condemn it so much. You could start here.	
FALSE, The Soham murders were the worst of child abuse. Good enough reason for home-schooling?	
TRUE,"cannibaldaveNot particularly unusual among the people I know. I just had nothing in common with the people I went to school with. Why should I? The coincidence of age and living in the same area were all there was to go on. You could call that in itself a very narrow prospect. The friends I had were of all ages and from a variety of different localities. ""A school doesn't need to be 'a nightmarish bully fest' to be a bane. All it needs to do is to fail to provide a totally unstimulating environment. Which mine did. It was boring tedious slow and frustrating. I learned nothing that I did not know before other than a handful of French verbs which have so far been of as much use as a chocolate fireguard. """"Each to his own as I said. If you really enjoyed school good for you. But don't assume that one size fits everybody because it doesn't. """
FALSE,You don't need to go to the US to find reports on how home educated children do. Try looking at the research from Paula Rothermel for example which can be found via her website. 
FALSE,"Thanks for the statical analysis (henceforward to be known as the JennM's god daughter report). ""Good luck with educating your daughter at home Annabel. My only experience was meeting two children in France who were educated by their French/British parents. I was very impressed but obviously you'd need to look at a lot more examples. """"I think some level of supervision is essential but it might help if those responsible had a certain degree of sympathy for parents like you. """
TRUE,"Your statistics are flawed. Look at the various links on this page. In particular http""Perhaps the (perceived) problems with your god daughter were the result of her being ""schooled"" and not ""educated"". The difference is what makes home education work. "
TRUE,"@JennM 7 Nov 2009""I have a group of friends who home educate they include a doctor ex teacher a radio presenter and lots of really interesting people who don't want to put up with second best. I met them when I took my youngest child who was 8 at the time"
FALSE,Most teachers would secretly agree the need for full on home and parent inspections even for some who are being sent to school. Stop blaming us and look at what happens at home they might say. 	But who could turn Ofsted on their worst enemy?	Good luck with the home schooling. Just I hope you have a lesson plan for each activity and a firm commitment to continual improvement. 	
TRUE,I trust that was tongue in cheek? Lesson plans (and the national curriculum) are the death of real education. 	
TRUE,"Shermanator how little do you know about home education - your comment ""The development of these social skills is something that simply can't be duplicated in a home setting."" is totally ridiculous! Home educators do not lock their children in cupboards all day and only bring them out on special occasions! I know a lot of home educators whose children are involved in	"" music lessons ballet drama St John Ambulance groups Guiding and Scouting etc etc. Children who are home educated are far more articulate than their schooled peers they have great confidence and they can socialise perfectly well with all ages whereas schooled children tend to stick to their peer group. Where in the world of business do you see an office full of 18 year olds and another full of 26 year olds - you don't! ""People who mention socialisation as a plus for schooling really should look at the product the schools churn out! How many 'hoodies' are home educated? How many pregnant 14 years olds are home educated? How many young people who knife their peers are home educated? How many underage drinkers/binge drinkers are home educated? How many smokers are home educated? Need I go on? 	Before using fallacious arguments people really need to look at the evidence and get their facts straight!"
FALSE,Surely there will be an increased risk to children in the new Free schools that can be set up above shops or in any other vacant building and which are outside local authority supervision. 	Do all involved even have to be CRB checked?	
FALSE,"6 questions. Just putting them out there for the room....	1) What the hell does this even mean?	2) Is there actually anyone who doesn't blame the mother and her partner?	3) Has anyone anywhere actually been accused of hate speech for doing so?	""4) No seriously anyone?""	5) Even by implication?	6) Do people who take up armchair warfare against the phantom PC menace ever stop and listen to themselves?"
FALSE,Where are all the chemicals the bunsen burners the physics circuits a shedload of other equipment and dead animals to cut up and all of the rest? 	1 in 3 state schools do not have practical science lessons because the kids can't be trusted not to test chemicals on each other. And they cut up live animals for fun in their own time.
TRUE,@oommph - here you get to a sensitive subject - modern science contains hardly any proper science just compare the exam papers from the past decade with those from the 70s and 80s. You're also making the mistake of directly comparing discrete subjects fr
FALSE,Well I'm acquainted with four cases and they are all more or less positive. Which trumps your three. QED. 	A pity you didn't receive a home education eileenphoto. Or some kind of education at least.	
TRUE,@eileenphoto	.	School can be very bad for you. For some people it can be a catastophic experience from which they never recover. To claim otherwise is rank ignorance. 	
FALSE,This comment was removed by a moderator because it didn't abide by our community standards. Replies may also be deleted. For more detail see our FAQs. 	
FALSE,Conversely - why keep your child home ever why not enter them into full time daycare from birth and let the state educate them from start to finish? Because your query makes as little sense. Families choose to access state provision if and when they feel they need it. For some families this is earlier than others. Why do you have a problem with that? 	
TRUE,"Just wondering what kind of sports days or school discos do home educated children enjoy?	""No I thought not.""	"
FALSE,"Interesting question - Just the other week we went to a Home Ed camp for the 1st time. It was fun. The children put on shows; from the youngest doing quick caberet acts to the teens playing in bands and DJing at the discos each night. 	""Oh and they had two separate sports days for older and younger children.""	""Not all home ed families are into camping but I think that a fair number of local groups also organise things like that too. """
FALSE,Good night folks can't believe I'm saying it school forever! I had a hellish time.	
FALSE,"Heavens! What could possibly be worse that IDEOLOGICAL REASONS!!! ;-)	""I knew someone who once gave money to charity purely for ideological reasons. It was quite shocking. I've even known some freaks who refused to eat meat simply because of ideology. ""	""If only people did things purely out of a mechanistic assessment of probable beneficial outcomes where 'benefit' is a universally accepted set of criteria agreed by all of society. ""	"
TRUE,"The topic of home schooling is a difficult one whilst in some circumstances it is the most appropriate way for a child to learn and it seems that many of you who post here who have experience of home schooling are very dedicated and are doing a great job in other circumstances I don´t think that it is appropriate and through a lack of parental ability/knowledge of the area it may not be the best thing for the child. 	""I have recently had a conversation with my mother about home schooling as a family friend has taken this approach and she feels that in our circumstances it would have been impossible for her to home school me as she has always worked full time and in certain fields doesn´t think she would have had appropriate skills to comment or help me with the work that needed to be done. ""	""It is my personal belief although many of you will disagree that in the majority of cases a child is best in school being able to mix with a greater number of students and take part in extra curricular activities. Jemmo suggests that ""	""which was not my experience of school at all. There were around 200 students in my year and my classes were mixed with a variety of them not just a particular form of thirty. In addition the extra curricular/sports activities brought together students from all the different year groups enabling us to mix and interact with both older and younger students. ""	""To respond to this particular article I don´t think anyone is particularly trying to blame home education for this particular case. However I don´t see anything wrong with a registration system where the quality of education is monitored periodically - the authors express concern that home eduation is totally different to school education and so they may be judged by `""""people who do not know what they are judging"""" but given the increasing popularity of home education would it not be possible for education professionals who do understand home education to be able undertake tasks like this? (I don't know if it would be this is a genuine question are there enough people in the system with knowledge of home education to be able to implement such a scheme as this?) """
TRUE,Purposely raising your children to be outcasts is child abuse I don't care what kind of cult you belong to. 	
TRUE,I'm always fasinated by the ideology argument. That it is wrong to do something because you belief it is right and have thought about the ideas behind it! To not have an ideology - does this mean that you don't think that any other world view is acceptable or that you simple don't think? If you look at education philosophy and ideas it becomes clear that our current state school system is very much based on a narrow set of ideas. Early formal education adult-led activities single age classes each child across the country pretty much studying the same thing in the same way at the same time irrespective of ability interest or other opportunities. One single ideology! Independent schools have much greater freedom to follow other educational philosophies and practices - Montessori Steiner small alternative schools and Summerhill being particularly noteworthy. But there is in practice very limited access to these - it costs money and these schools are few and far between. Home educators on the other hand can use all these methods as and when appropriate. They can use tutors courses other home educating parents older children other specialists with other skills and knowledge books science kits a bought curriculum internet resources etc etc. Home education is for most a community enterprise. Home educators come from many backgrounds with many different beliefs and use many different educational methods - from the very structured adult-led to the informal child-led. Some choose it at the start because their child appears to be unsuited to early formal education or because they favour education methods not available in state schools. Others come to it later because school has not worked for their child. But they are guided by their own values beliefs and yes - ideology. But then everyone is. To say school is best is every bit as ideological as any argument for home education. If we don't make decisions based on our ideas and beliefs our moral values and our understanding of the world - then surely we are failing to do our best for our children. Whether the result is choosing a state school independent school or home education will depend on our children our selves and our family situations. 	
FALSE,''(I don't know if it would be this is a genuine question are there enough people in the system with knowledge of home education to be able to implement such a scheme as this?)'' 	No	
FALSE,"Good for you. I am pleased your children are so fortunate. However having actually been both in and out of state education I do not think that this is common. Certainly the fact that ""In 2003 an estimated 75 per cent of the adult population of working age had numeracy skills below the level of a good pass at GCSE and 56 per cent had literacy skills below this level"" suggests that I am not far wrong but of course all their parents may have taken an interest and just been rubbish at it... 	""I also think I was making it clear that I was not saying it IS the case just that from my experience this is what SEEMS to be the case. Since I did actually point out only sentences before that I did think that generalisations were impossible due to it being reliant on individuals that it would be obvious that I did not think this is always the case. I just think in my opinion that when a person hands over the lions share of the educating of their children to another organisation that maybe even if only subconsciously they feel that this is them fulfilling their responsibility and that they may then put in less effort themselves... """
FALSE,"metal dad	""This thread has given me food for thought and I can see that the issue is a more complex than may at first appear. Preconceptions abound and some of them probably do need exploding. Without wishing to sound trite at the end of the day if (a) parent(s) love(s) their child they can't go far wrong no matter the pedagogy. ""	"
TRUE,"I was home educated from aged 10 onwards; my parents were the most fantastic enthusiastic teachers. My personal experience of mainstream school was damaging. 	""My parents didn’t take me out of school to ‘protect me from the world’ good grief what a stupid thing to do! (And non of the home schooling families I know did/do that either so what a silly thing to assume that's why families do it). They removed me from school because school/teachers were teaching me nothing other than ‘you are thick so why bother teaching you’. Their teaching methods no matter how hard I tried to understand just did not work for me. I tried SO hard to understand I didn’t want to be ‘behind’ the other kids but it was no good. No matter how hard I tried it was not good enough. My parents knew I was capable of more that I was intelligent but somehow school weren’t willing to see it. I wasn’t me that ‘couldn’t be bothered to learn’ it was the teachers who couldn’t be bothered to teach. ""	""To assume parents who home school are ‘cruel’ could not be more wrong. To send a distressed and terrified child to school everyday is sick! For the record my parents aren’t hippies or God fearing Christians. Also to sate that home educating families are middle class could not be further from the truth with four children and my father receiving a pitiful wage as a hill farmer and my mum being an unpaied housewife they nor I fall into the bizarre and inaccurate stereo type of a home educated family. ""	""As for social interacting I used to go on camping trips day trips I would study with friends by rivers in the woods on the beach or just pop round to each others houses. It was such a positive and wonderful experience my parents travelled far and wide to give me these experiences for that I will always admire them! ""	""@ calminthestorm. I certainly know more than 3 home educated people non of which went off the rails yet I could compile a huge list of children that attended school who did. How many home educated children do you hear of that have ASBO’s? How many hom""	""Since the age of 10 I’ve had to put up with people judging something they don’t understand telling my parents that they’re wrong for home schooling me (even though I could not have been happier) they never asked me (the one being home schooled) how I felt about it if they did they still wouldn't have listened they've made their mind up and they are sticking with their inexperienced views. I’m sick to death of it! It is and always has been pure ignorance stop slating something you have no experience or knowledge about. ""	""I am one of 4 children my sister thrived in mainstream school so my parents let her stay there my two brothers went to a different school altogether school for boys with learning difficulties and they thrived in their school. To believe ‘one size first all’ is clearly coming from people who have never suffered from learning difficulties themselves from bullying from the physically ‘sick with dread’ feeling one gets on the Sunday knowing that tomorrow is a school day. I’m dyslexic at school I could barely read but after being home schooled my GCSE’s were mainly A’s and B’s and I now have a degree this would not have been possible at school. I would have failed without a doubt! I have a daughter now and after an awful lot of thinking and discussing I feel she like my sister is well equipped for school (emotionally mentally and academically) I feel when she starts in September she will thrive. However if I were to have another child who knows maybe if I feel he/she will benefit from being homeschooled that will most definitely be the road I go down. ""	""All our children are different so why should we teach them all in the same way/style surly that’s just common sense? """
FALSE,@ Pastis...	I hadn't actually seen this comment when I posted mine.	I am indeed encouraged.	
FALSE,"The law in Virginia turns Pap Finn loose to keep his son ignorant and uneducated. Here's what Pap Finn said about Huckleberry learning to read and write""You're educated too they say—can read and write. You think you're better'n your father now don't you because he can't? I'LL take it out of you. Who told you you might meddle with such hifalut'n foolishness hey?—who told you you could? ""	Well no one in Virginia would step in and get Huck to school. That would violate Pap Finn's religious freedom. 	"
FALSE,"dennis B said ...	"""""" The actual law of the land"""" is what the people living there agree it is. """""""". """"""""""	so we are all in agreement	too rich ...	"
FALSE,"Atheists will deny that our unalienable rights are God given but if that assertion is true then there is no sound philosophical footing to claim any unalienable rights at all. The prime purpose of law is to protect an associated right. For example the commandment ""Thou shall commit no murder"" ordains the right to life and ""Thou shall not steal"" asserts the right to property. 	""If the atheistic worldview is correct then the only place """"rights"""" can come then is gratuitously from the state. That would set the stage for tyranny for the state would no longer be just the earthly protector and curator of unalienable rights but would be the divine provider of them. The state would thus have the just power to give or withdraw these rights on a whim and they would because governments are inherently corrupt and have the power of coercion. If unalienable rights can only come from the state then there is no just reason to rebel against tyranny. Unless government has limited authority and jurisdiction under God those unjustly oppressed by the state cannot lament that the state is ruling unjustly. ""	""Atheist will at least affirm that the power to govern comes from the consent of the governed but if individuals didn't have God given unalienable rights to begin with there would be nothing negotiable to concede to the state in order to empower the state to govern. ""	""As a result atheism by virtue of his own theory of origins is hard pressed to prove that unalienable rights exist at all and therefore can only deny them and incorrectly believe they are the exclusive domain of the state. Man is not God. ""	"
FALSE,"true rights are given to men by God and are inalienable because no man has the authority to deny transfer or take away what God has given. 	""The nature of rights is a function of one's own authority not someone else's. Authority to a """"right"""" is exclusively given by God or voluntarily conferred. A person may by choice forfeit or waive an inalienable right but a person can not waive the inalienable rights of another. ""	""Civil governments are granted powers but no inalienable rights. The people can give some of their powers to government but they can never give away their rights. ""	""The only purpose of civil government is to protect the inalienable rights of non-civil institutions and those of the individual. (e.g. right to life liberty and security of the person) However modern law has been perverted and now ignores the distinctions between rights and powers. Civil powers now run roughshod over individual rights by no longer recognizing unalienable rights. ""	""As such laws are in conflict and are being unilaterally balanced by civil authority but true rights cannot be balanced. true rights can never be balanced with or against each other because true rights never actually conflict and therefore do not need to be balanced. true"
FALSE,"To pray or not to pray	""The founders of this country built Canada on the Word of God as can be seen in many examples. The name """"Dominion of Canada"""" the motto of Canada """"He shall have dominion from sea to sea"""" and the phrase on Canada's coat of arms """"A mari usque ad mare"""" (Latin for""	"" From sea to sea"""") are taken from PSALM 72"""
TRUE,"I think that what we're doing is what we should be doing as a school board and that is accommodating students' needs no matter what their religion is said Gerri Gershon a Trustee for Don Valley West where Valley Park Middle School is located. ___ 	""Wrong again Gerri Gershon. What you should be doing is paying attention to the task of educating with no regard at all for religion. It's a PUBLIC school board and there are clear laws regulating your turf. Stop trying to 'accommodate' which I suspect is another word for 'shirking your responsibilities' and 'sneaking prayer through the back door'. ""	"
TRUE,Nobody needs to be practicing religion at a public school. The whole point is to separate education from religion. If you want your kid learning and praying in the same place then send them to a religious school. 	
FALSE,"smarmy bastard 2011/09/19 at 6	""00 PM """"   ok so obviously  there are more free thinkers who would agree with you .... and because there are more than one free thinker(s)  it becomes a group of free thinkers ...who all agree ... hmmm (head hits floor)"""" ___ ""Smarmy	"" now you're just being disagreeable. If many people independently think for themselves without being told what when and how to think it does not follow that they all think the same thing. """"Following"""" is an attribute reserved for religion. ""Me thinks your head may have hit the floor too hard this time."
FALSE,Is it a public school or a madrassa?	I think its a public school.	
TRUE,Nothing wrong with Muslims praying in school.	Just like nothing wrong with Christians or Jews now able to do it.	The rules will apply to everyone.	If Muslims are allowed then all faiths are allowed.	
FALSE,If people are mad at least that shows they take religion and its message seriously...	Such passion should be commended and analysed...	
TRUE,No organized prayers or services anywhere on public school board property - FOR ANYONE.	
FALSE,This is what happens when polite Canadians go to lengths to show they are tolerant. We sacrifice our own beliefs promote others and bit by bit we allow our way of life to be subjugated. We are then given the ultimatum of join us or else... 	
FALSE,"Doesn't this particular accommodation stomp on a couple of human rights? In this PUBLIC institution (and I believe some others too) during class time only one religious group is allowed to use part of the school--it's closed to all others. Discrimination based on religion no? The girls are consigned to the ""back of the bus"" (and others to farther ""back of the bus""). Discrimination based on gender no? Again in a PUBLIC institution. 	""My understanding is that most public schools do accommodate the same religious group but in acceptable ways. To my mind what's happening at Valley Park Middle School is profoundly and distressingly unacceptable in a pluralistic secular society. ""	You don't know what you've got till it's gone.	"
TRUE,Keep church and state separate. Period. Anything else = chaos	
FALSE,"This is going to remain a problem while bigots in Ontario defend one particular religion having 100% publicly-funded schools ignoring the lack of equality. 	""If you want to ban this kind of thing you also have to ban publicly-funded Catholic schools in Ontario the same way they have been banned in recent years in Quebec  and Newfoundland & Labrador. ""	""Christian schools were previously protected in those other provinces and there was no problem in amending the Constitution to remove that protection. ""	It's time to end the bigotry!"
FALSE,#NAME?I often think Christians invented hypocrisy! ________________________Christians may not have invented hypocrisy but they did make it an art form.	
FALSE,"If religious people want to be taken seriously they should be required to 1) produce their god and 2) show that it's capable of carrying out its childish threats if its followers don't do what it supposedly demands. 	""Otherwise keep it to yourself."""
