LABEL,TEXT
TRUE,You have to be very careful comparing Australia to the UK and USA. Here we have a parallel public system called systemic Catholic schools - they are low fee charging and widespread across the suburbs - they are not really elitist private schools and when you factor in them to the mix the figures in private are not that different. 	The best schools for academic achievement are selective state schools - they don't get the unruly kids and they don't get the thick kids whose parents have to pay a lot of money for them to be coached through private school and then use their connections to get a job when they can't do it from their own abilities. 	
FALSE,Eventually we will have a complete user pays educational system. Children from families who can`t afford the exorbitant fees of the best performing schools will receive a mediocre education. 	
TRUE,I have been a long term defender of public education - although fortunately have the advantage of living in a higher SES area where the public schools are relatively well resourced. Made the decision this year to move eldest child out of the public system and into a Catholic private school as really felt that the large public high school didn't have its eye on the ball when it came to student welfare particularly in relation to bullying between the boys and self harming and worrying attitudes to eating amongst the girls. Also while academic standards were high it was very much a 'survival of the fittest' type attitude which posed challenges for our bright but sensitive daughter. We are finding the Catholic school much kinder and more supportive on the whole and also surprisingly stronger on things like social justice and inclusion of students with disabilities and that type of thing. 	
TRUE,"I think that the superiority over one type of schooling doesn't exist. It all depends on the person. I went to public school and was in every club president of some and also was in the Student Body Presidency. Public schooling creates lots of oppurtunities to meet large groups of people. This was good for me because my type of personality is to lead people though usually through manipulation bargains and other types of persuasion not because im a strong leader. At the same time I signed up for homechooling so that I could launch myself into college. I've never done regular homeschooling though. So I don't have grounds on it. But I live in a community that could be considered a little rednecked and the extremes are a little more common here. But hey my first year as a full time student in college was at 13 which I'm not anyore but i feel like im behind because all of the General facts about things you learn in regular school I don't know. Where you could study the World in Highschool I might spend two years just to get an overview of the United States History in college. 	""Another point to be made is your peers if your a introvert than it doesn't really matter which school you go to on this point If you are an extrovert then here are the facts""	"" when public school was created many people grasped it to recieve a free education and now it is a part of everyday life at least it is in the United States that means that there are a lot of poeple in public school and so it would be great for an extrovert. On the other side Homechoolers depending on where you live and possibly how you are homeschooled have homeschooling groups which not only have a large group of people though usually smaller thatn the public school but have the freedom of doing things togethermore often Time schedules are more flexible and if you really wanted to you could skip a whole day of school in the middle of the wek just to hand out eith people. This point may actually lead to a superiorty in certain areas on one side or the other """
FALSE,The politics of envy?	I think it's a question of perspective. You could view the private vs public in elitist privileged class terms or you could view it as a healthy sign that a significant proportion of Australians think that the public education is under resourced. 	They choose to resource the education of their children at a higher level than the state thinks is adequate - thus as a society we are shown as valuing education higher than our oft quoted OECD rivals. 	Of course the rise in the influence of religion in the education sector of our otherwise secular society is another question. 	
TRUE,I went to a private school and the public system could never have given me the same experience and quality education. We should make the public system as good as possible for those who can't afford it but if parents want their kids to get a better education than the system provides don't stop them. The government doesn't have to intervene in everything. 	
FALSE,"Sally	One glaring issue	""they've paid high real estate or rental prices to be in suburbs where the local state schools are mostly and consistently very good. ""	""That's not true in Stonnington which doesn't have a public high school - AT ALL. Kids living near Punt road are told to go to Hawthorne. ""	"
TRUE,"This article fails to concentrate on how the overall Catholic school sector receives less in total Federal and State Government funding than government schools. 	""However those of us who choose to send their children to Catholic schools pay both fees and taxes and actually save governments money. ""	We do so because Catholic schools have Christian values - not the value-free 'education' one might receive at a Government school. 	"
TRUE,"I'm going to start this by saying that I have no read every post in this thread. I don't have the time. But having been home schooled (or 'unschooled' as my parents like to say) I would like to add my experiences. 	""My parents both attended public schools growing up and both went on to higher education. My dad has a Masters degree and my mom has a Bachelors. Both of them hated school up until college. Well my dad really hated it up until graduates school but close enough. So when they had kids they decided not to send us to any kind of school unless we expressed interest ourselves. Our family has a rather unique living situation though which made my parents equipped to teach us in a way that many parents lack. ""	""We live in an intentional community in which people come and go on a very regular basis. When I was born we lived in the city and by the time we moved to the country when I was three I had lived with over 50 different people. And those were the ones who stayed more than a week. Things move a bit slower in the country but we still have a lot of people moving through. I've sat down to dinner with people of many races genders ages and beliefs. Every single person I have lived with has taught me something whether it was intentional or not. ""	""My parents also love to travel and since neither of them have a 9-5 job we took a lot of road trips when I was younger. We spent hours in museums libraries art galleries. I learned to read at 6 and have been an avid reader ever since. My grandmother is an artist and so we learned to draw paint and sculpt from her. Myself my brother and my sister all tried public school at different points. My brother lasted through the entirety of 8th grade and half of 9th. I did two weeks of 8th and my sister was only there 4 days also in 8th grade. After that attempt at school I decided to go ahead and get my GED. I had took months of weekly meetings with a math tutor my first traditional learning experience since my mom taught me how to read. I passed the test at 16 with a near perfect score in English and high scores in every else except the math which was merely passable. My sister is now attending the local community classes at 15 and my brother (who also got his GED at 16) has an apprentice ship with an electrician. I work full time at a stable nearby teaching at risk children how to ride horses. ""	Home schooling is definitely not for everyone. My parents had the resources to be able to educate us in a way that school would have been unable to do. If I ever have children I will definitely be home schooling if possible."
TRUE,"Private schools producing more 1-dimensional bigots with an overblown sense of self-entitlement than any other education option... 	""#Rex""	Of which most of them become either lawyers or politicians."
TRUE,"Don't need statistics just need to put your kids into the public school system to know they're being disadvantaged through under resourcing and teachers ill-equipped to deal with the policies they are meant to be managing i.e. bullying attire social attitude etc. 	The number of parents pulling their kids from the public system speaks for itself in how the public system is operating. 	Pulling my kids out of the public system was the best thing we ever did for them!	""Out in the Western suburbs where we can afford to live public high schools just won't do unless you're happy for your kids to be beaten up spat on thrown rocks at and depressed going to a school full of delinquents who swear at teachers & disrupt the class all day. How can they learn and grow in such a place even with high involvement and support from home? ""	We tried it. Pulled one of our kids out of a private school into the local public school. An outgoing & popular bright teenager transformed into one hiding in closets to avoid school. Pulled him out again and put him in a selective school and he's loving it. 	""Unfortunately for parents who cannot afford private education live in certain suburbs or who want to send their children to a public school the selective system is the only one that will nurture and encourage them to learn and grow amongst peers who want to learn. Parents should not be judged for trying to do what's best for their children. Agree with Moore that our children are not to be sacrificed for a utopian ideal that is just not going to happen any time soon. ""	"
TRUE,When 2 parents are working and already paying for daycare most private schools seem cheap.plus they will discipline your kids for ya as well bargain.
TRUE,The advantages of a private school are largely to do with the quality of student attending. My daughter attends a highish fee private school - I can tell you the teachers are no better but by heavens the kids are. Also the facilities and environment are outstanding. 	(And I work as a teacher in the public sector.)	
TRUE,The drift toward private schools was predicted as far back at the mid 1980s when I first became a teacher. It was said that a 'voucher system' would eventually be put in place where by the funding attached to each student would 'travel' with the student. This meant that the public school funding would be dependent upon demand from the community. As a publicly educated teacher I was concerned about the genesis of 'schools of last resort'. Later as a parent I changed direction and became worried about the behaviour that impeded learning and teaching in public schools- behaviour that I witnessed first hand. Consequently I chose to move my own children from public to private. I own up to being part of the problem of the weakening of the public system. I couldn't abide that my own values of respect cooperation and high expectations were not being held for my children in the public system. The teachers in both systems are the same but the expectations of the parents are simply different. I want for my children what my parents did not have to pay for!
TRUE,"My children cannot attend their local public school	"" it is completely dysfunctional enforces no discipline and is ruled by bullies and bad behaviour. More than 2/3 of those who complete their schooling fail to obtain a certificate. """"I therefore have to send my children to a nearby religious school where discipline is enforced bullying is addressed and academic standards are acceptable. ""	""If the government sector wishes to address its appalling reputation it will need to ditch decades of trendy anti-academic thinking that has resulted in this mess. ""	""My children cannot attend their local public school: it is completely dysfunctional enforces no discipline and is ruled by bullies and bad behaviour. More than 2/3 of those who complete their schooling fail to obtain a certificate. ""	In St Leonards? Really? I think you're a bit hysterical there mate."
TRUE,"Woahhh guys some of this is starting to get a little attack-y.	""I'm on the homeschool side of the debate. That said I don't believe it's the best in every single case. For the purpose of this argument I'm referring to homeschooling as any kind of flexible education""	"" online schools unschooling a hodge-podge of curricula from different places anything. But here are my reasons""""1.) The primary responsibility of the education of a child rests on the parents. Children are not owned by the government and the government cannot tell people how to raise their children. Some of you with different political backgrounds may disagree but this is what I believe. Ideological reasons for homeschooling are in my opinion completely legitimate. ""	""2.) Every child is different. I see a lot of you on both sides saying this too. Homeschooling allows you to tailor your education to whatever way helps you learn best. My school has a heavy focus on writing and using essays. This really helps me retain the information and so it's wonderful for me. Other schools have other methods. But when you put 30 kids in one classroom it becomes very difficult to teach them all individually. ""	""3.) The public school system in most places is out of control. I know some of you are saying """"Well in MY public school they didn't...."""" and that's great. Maybe for the people who live in that neighborhood homeschooling isn't the better option. But I had to go to my local public school to take the PSAT and someone was getting arrested as we were leaving. So in some cases there's a safety issue. In other places it's what kids will hear and I'm not talking about peers. This isn't the place to argue about Planned Parenthood but the things they say to children as young as ten are things that shouldn't be said without a parent's permission. Schools everywhere are failing to crack down on issues like bullying and failing a lot of other things too. ""	4.) You don't have as much busywork. I can learn and do schoolwork and still have time for loads of other experiences. Kids have too much homework; no one I know who goes to school gets enough sleep. 	""5.) There are exceptions to this but this is true for the MAJORITY of homeschoolers""	"" you get healthier socialization! I have so many AMAZING friends now from homeschool events. There are such things as homeschool groups and we get together just for the purpose of socializing. Plus you're exposed to a wider age range when you're homeschooled. I would think it weird to talk to someone in another grade back at school but I have friends I can honestly call BFFs ranging from age 11-23. """"So those are my main points. I could go on forever but I won't. Healthy wonderful people can come out of any education; same for unhealthy people. I do know one family over-sheltered homeschoolers who fit the stereotypes; and I know some AWESOME WONDERFUL people who go to public school. The point is not to fling those stereotypes back and forth but to have a respectful discussion about the ideas of a home education versus a public standardized environment. ""	""And if any part of that made no sense just point it out. It's 12""	40..."
TRUE,"A few points the ""perceived advantages"" were hardly touched on in this article. I know there are some advantages at private schools having gone to a woefully basic selective high school. 	""Having said that a private education is no guarentee of a job nor that you will always have that job...I have seen plenty of people being shown the door in the corporate world for being incompetent lazy. stupid or getting their hand caught in the till.....the boss does not care where you went to school when it comes to firing for these """"crimes"""". ""	""I am delighted with the education my kids are getting at a private Catholic school for the fact that trouble makers are dealt with resources are good and it is hard to put into words but someone is keeping an eye on them all the time. eg daughter in yr 10 decided not to do a science for yr 11 i received a call from her academic advisor about this and how did i feel about the career choices she was shutting the door on. I really appreciated the call as it meant someone genuinely cared about her future. ""	""would this happen in a state school? I doubt it as there are not the funds for a full time academic advisor. ""	""Ditto social justice and pastoral care. I recall two girls at my high school had a parent die. We were never formally told we just swept it under the carpet...i still feel gulity for never saying """"so sad for you how can I help you now that you mum has died."""" At Private schools a food roster is started and kids are told to reach out..I know it may see irrelevant but people care more...for me this is the perceived advantage of private schooling. """
FALSE,Having taught for many years in both State and Catholic schools in not so salubrious suburbs I would make the distinction between the local systemic Catholic school and Private schools which charge exhorbitant fees. Fees at systemic schools are set by the system and vary little. I have not had many wealthy children in my classes. By the way teachers are all taught in the same institutions its the way all schools are run and how much time and effort parents put into their children's education that counts. 	
FALSE,Touche! Joey's Dad Touche!	
TRUE,"I never intended sending my sons to a private school but having got elected to my local primary school council and been immersed in the curriculum review process it was clear that there was a huge miss match between the idealistic educational model the resources quality of teachers (most then worn out) and the many problems of many students requiring attention to basic skills. Moved to private system which has same lofty aspirations but they cull out the students/families they do not want have better age/gender balance and have slightly better resources. We were told one of our sons was ""a bit slow"" by his Year 2 teacher and not to expect too much. He won school prizes for 3 out of 5 subjects in Year 12 at a highly regarded private school. It is important to note that class sizes are similar in most private schools with better curriculum and less problems with students/parents making life simpler for parents. Unfortunately parents I speak to recently have same or worse experiences with public school system. Teachers I know who have moved from public to private are amazed at how much easier teaching is because the school is able to insist on basic standards of behaviour and doing things like homework. I think Sally Young needs to talk to a few parents who decided to switch to find out the reason is more pathetic performance of our public school system despite massive increase in funding over the decades. 	Another dose of honesty! But who is this 'miss match'?"
TRUE,"Are there any statistics on privately and publicly educated students being accepted to Australia's top universities? I went to a state school for the first 3 years of high school where I recall not much of my education there- it was mostly ""Australian"". Then my parents moved me to an all-girls catholic school (I was being bullied at the public school) where the value of education was much higher academic achievements were celebrated and we had motivational speakers regularly. I'm sure that socially I would have stayed the same had I stated at the state school but not academically."
TRUE,"Thanks for an entertaining very timely infomercial for conservative state governments. Our kids attended state schools and excelled one to doctoral level. They did comment that private school students at their university experienced more difficulty than state school educated kids... and research indicates that coddled spoon-fed learners have trouble coping when that silver spoon disappears... . 	""SV that reflects my personal experience of teaching matriculation courses in TAFE. About 80% of the time you could pick the private school repeats who immediately asked 'what's the answer?' rather than 'how can we work it out?' As always there were honourable exceptions. """
FALSE,Let's not beat about the bush people. When our eldest started at a state high school this year many of our primary school parent friends were horrified. And although they would always check who was listening before saying so their primary concern was that there would be too many Asians there. And it was the same regardless of whether they were left or right of centre with their politics. 	
TRUE,"I find it deeply offensive when parents imply that they send their kids to private schools because they care about them more. There's plenty of evidence to show that the best thing you can do for your kids is engage with them (ie. more time at home less time at work) and make their home life an enriching one. This is not about real ""choice"". When middle-class parents go private they are supporting a shift that will see public schools become a residual system for the poor. I send my kids to public schools because I care about them - their links with their diverse local community etc - but also because I care about the kind of culture they live in. To me learning to care about and contribute to society as a whole - not just your own personal interests - is the best value a child can inherit. 	""How well a child does at school depends on the child itself not the school it goes to.Attitude to studies is all important.If a student's mind is occupied with sex drugs and alcohol you can't expect good results. Set high moral standards for your child and encourage the proper attitude to study and life in general and it won't matter which school he/she attends.Education for life is not solely the job of teachers it starts at home in the child's earliest years.Parents should lead by example. ""	"
TRUE,Tried for three years to keep my children at the local public school. On the school board etc. If they want the middle class to leave their kids at public school they need to put effort in to meet their educational needs of the children and give us a reason to stay not just fob us off with your children will be all right because of their demographic background. The standard was set at the lowest common denominator with no effort put into challenge children who were bored. They need to bring back classes where all children's needs are met not just the worst behaved why should the whole class be punished because one child's behaviour. Composite classes should be discouraged as teachers are unable to meet all the levels needed and are more likely to ignore those who can do the work at the higher grade. They do not have time to offer more complex work or seem reluctant to celebrate intelligence attention to detail and completing work that comes from the higher achieving students. In all of the three years before baled from public school despite talks and promises that things would improve nothing changed. We left and went from bored hating school children to excited about learning keen to get to school enthused again. Not exactly over night but certainly by the end of the 2nd term at the new school. Public schools need to do more to keep those of us who care about education attending their schools.
TRUE,I know in this state the kids have to pass a yearly assesment test. They will take away your rights to homeschool based on the outcome of the testing I think that's a good thing. My problem is when a parent doesn't put the effort in to socialize the kids they are in too narrow of a group of friends and not allowed any friends out side of that group. 	
FALSE,That's what I see in my homeschooled gk's. I don't have an issue with homeschooling but think they should be allowed to play with the local kids that don't go to thier church play community sports and such. I worries me but yes I do keep my mouth shut some times it's kind of hard when your having a conversation with gs who mentions he'd like to try playing soccer. 	
TRUE,"Depriving your child of a basic education is a form of child abuse. It can ruin your child's whole life. 	Home schooling should be illegal unless the parent can demonstrate that they are providing the same level of education as a public school. There should be a core national curriculum and testing to ensure children are achieving at least a basic level of education. 	""In an increasingly complex global technological society all people need to have a basic understanding of science technology and local and global culture just to be able to function and make informed decisions. ""	""I don't see any need for home schooling any child unless the child has special needs or learning difficulties. If public schools are under-performing then the public education system needs to be improved. Public education in the US seems to be a self-perpetuating disaster with ignorant uneducated unqualified people on school boards deciding what children should learn. ""	"
