LABEL,TEXT
TRUE,"Is it wrong for parents to send their kids to private schools? That's the title of this article. ARE YOU KIDDING ME?!?! What is this China for crying out loud!?!?!? Give me a cotton-picking break!!!!!!!!!!!!!! Parents can send their children to whatever schools they want! Period. Pay attention to the United States Constitution!   This is a free country at least for now... And unless you want to subject parents to anti-American communist laws; then stick your nose where it belongs and attend to your own children! No one should have the right to send children to any school except for the actual parents of that individual child!   Private schools are absolutely fantastic! Homeschooling is even better! Charter schools are the answer for public schools! Face it! The public school system is failing our children especially in the inner cities because it's the government that runs it. The argument should rather be for taking our children out of government run schools.   Use the same extensive amounts of money we all throw into the public school system via our taxes and give it to private charter schools and watch them absolutely thrive! That's the answer. And it's happening all over the US. We have awesome teachers in so many parts of this country including a ton inside our public schools.   However take the unions out of the picture fire all the bad teachers out there and put a performance-based system in place for a privately run charter school system throughout the country. Then take the incredible amount of money that we all pay through our taxes and put it into privately-run charter school systems that aren't mandated to indoctrinate our kids with all sorts of filth and error.   Our public school system is failing our children. So many of our children in America are being taught flat-out lies revisionist history and/or watered down historical inaccuracies. Every subject (math science language arts social studies etc.) in our public schools is being dumbed down to substandard education. We've got an idiotic student to teacher ratio. It's no wonder public school kids don't know basic facts. Here's just a few stats	"" 　 Only 43 percent of all U.S. high school students have any idea the Civil War was fought in the 19th century. ·More than 65% of all U.S. high school students cannot find Great Britain on a map.   Twelve percent of U.S. high school students cannot find the United States on a map.   More than 25% of all U.S. high school students thought that Christopher Columbus made his famous voyage across the Atlantic Ocean after the year 1750.   About 33% of all U.S. high school students do not know that the Bill of Rights guarantees freedom of speech religion and due process.   Only 55% of all U.S. students can name the Vice-President.   We need children with well-trained minds. Speaking of which there's a fantastic book on classical education titled""		"" """"Is it wrong for parents to send kids to private schools?"""" Please refer to the answers in my first paragraph. """
TRUE,The woman is a nut case! Lib mentality on crack! Maybe this woman needs to work and give all her money to the public school system so she won't be a bad person. My children and I all went to public schools. Hated it for them just as much as for myself. If there had been anyway possible that I could have sent them to private school. You betcha I would have. I think private schools are great and hope a lot more come about. I feel the private schools up the expectations and standards for the public school system. That's a good thing. And that's what scares these selfish people that want to take away people's freedom and start calling people names just because they are envious of what others have or do!  After all the public school systems get tax money from everyone even from the one's who send their kids to private schools. And the public school doesn't provide anything for those kids but the system still takes their money. 	
FALSE,Interesting that religion is a less compelling reason.	
FALSE,"The rational of this argument is not logical.  No one is to blame for poor public schools except for the public schools.  The ""entitlement"" suggestion that it is always someone else's fault is simply without any plausible reason to support this claim.  In fact it is very much ignorant.  There is no research to support this claim.  If a school is bad then it is the people within the school that need to stand up and put the effort into changing it.  Also there is no evidence that says ""more money"" will help a school improve.  It is the people that work there their motivation their ability to work together in a collaborative way and their ability to strive for success and to teach resilience.  You can't blame someone else who isn't even there.   Goodness goodness we spend more time whining than simply working hard and doing a good job. 	"
FALSE,<cough> white liberal guilt <cough>	
TRUE,I didn’t have the opportunity many have of going to a private school but I have to say that my life isn’t less good than any one who has had that opportunity.   I worked 10 yrs for a company where most of the employee under my wing went to some of the most prestige private schools and collages in my area.  I don’t agree that sending your children to a private school makes you a bad person but I do have to disagree with those who criticize public schools. The values that you teach you children at home along with extra encouragement and attention is all a child needs to succeed in any school whether it’s a private or public.
FALSE,What an asinine question. It's only wrong if you think it's wrong to send your children to private school.. 	
TRUE,"Ok....if you're going to make a point based on a snap shot (parents blame game) and consider what you see ""big picture"" how relevant is this story? The real story in many public school systems in the US is accessibility resources not meeting the standards of local and state municipalities all the while producing less than the worlds youngest and brightest. Environmentally speaking many buildings are not up to code (health risk – air quality) are burdensome regarding devalued property (dilapidated) a generator of many things bad (dietary etc.) teacher’s salaries unions and the list goes on. I side with the author on overcoming against the odds (with proper support). This factor is not one that fits the mold of the average person and not should be taken lightly as it does not apply to the average U.S. citizen. I sense the notion that public education isn’t required to be performed in a traditional school setting but may/should take place at the home with the parent(s).  So “YES” parents are wrong for paying taxes for participating in a not failing but “failed” public education system. Parents are obligated to be advocates for their children. Moving to a better zip code is not the option for the vast majority. Here’s the kicker what level of commitment is required to educate in the home? Do most households have the elements for educating students? Social development is very much needed in today’s global/international market(s). There’s no easy answer. To say parents are at fault is an easy way to get feedback/pulse in order to extract information from readers. No true, experienced writer is this naive! Our nation is faced with deciding quality of the short vs. long-term future and fabric of our nation. Taxes vs. balanced books/budgets are an ever growing challenge. The short cut to success in the eyes of attaining $/wealth is to require history classes of how the top 1% became the top 1% for K-12 grades. If you’re home schooled attend public or private school the exposure to what actually works and what it takes/took to reach the top is the reality students need to understand as well as parents. For those is think and say $/wealth is not everything I suggest “power” be the topic! Don’t be fooled …”the schools will get better”. Better at what? The reshaping of this great nation will be more than attaining $/wealth. Sustainability on most if not all fronts must be the goal! Sorry to have carried on but I don’t think the author of this article considered the audience to have been entrenched in the rearing of children. However I urge K. Wong to publish a strong comeback article given the feedback I’ve seen from readers. Note	"" if the K. Wong is a parent who has actually tried this and is a witness to things having improved by taking her own children from private school (whom in many cases exposes students closure to the 1%) and placing them in a public low performing school I say that history tells us that those who derail from what’s “norm” make it to the top 1%! If you don’t do all you can for your children regarding education it will show. If your children do not take to the education you’ve provided it will show. """
FALSE,The public schools are doing it themselves as well.  The same argument could be made for magnet schools.  You are taking the best and brightest along with parents who care out of their home area schools and put them in a magnet school.  This leaves the lower level students and parents who don't care left in the local area schools.   If pulling good parents out of the public neighborhood schools is bad for public schools then quit bussing the smart kids out of their home areas and leave them in the neighborhood schools.    Our obligation is to our own children first.  Even if my public school is providing a safe an excellent education (which mine is)  I should be able to send my children to a Catholic Jewish Buddhist or secular private school if I believe that is in the best interest of my child.  My child is not a pawn to be used to better a system that is slow to improve. 	
TRUE,DO YOUR RESEARCH BEFORE CALLING ME A BAD PARENT!  I am not wealthy my daughter went to both private public and back to private. Even with a reputation of a good school district I have a child with special needs. She had no time to sit on a waiting list for services secluded programs as I was even willing to pay. I fought for her her doctors fought for her with zero results. I made those payments I gave up vacations and even my car. Today she works goes to a great college does not live off a system. Let me remind you the public school wanted to keep her until she was 21! To do what? By now she has two years of college in working on Chemical Engineer Degree.  She works to pay for college. Not to  live on a system that would have done nothing but spent your money. NOW CALL ME A BAD PARENT!!!
TRUE,I believe that envy is one of the carnal sins. Any parent and I do mean any that would do less for their children than they are able to are guilty of child abuse. If you have the ability to send your children to private school and choose not to then it is clear that you love money more than your children. Parents who send their children to private schools do support public schools. Just who do you think pays for the schools? They pay most if not all of the taxes that support the socialistic schools. Few children can rise above the poor education of a public school and that is why most of our leaders attended private schools and why they send their children to private schools also. A very few excel but they are the type who would have exceled even without schooling so they exceled in spite of public schools. What is wrong with this country is public schools and people that believe that someone owes them something. If you wish to improve public schools the only answer is to get government out of education and turn it back to local control. When I went to the schools about my children I was treated like an interloper and talked down to as if I was beneath them. The schools and government seem to think that my children belong to them. 	
FALSE,The author needs to stop assuming that the readers are as uneducated as she is. I think that vouchers would help some students get a much better education. Let's see now which political party controls the public school system? It's the same one that is totally against vouchers. Hmmm. 	
TRUE,BIG E.what about all the money we do send to our schools .does it help our child. no .teachers keep asking for more with no difference in teaching just more money and if they dont get it what happens they strike .well thats real nice on kids education is it not boo hoo you TAKE YOUR KIDS PRIVATE IF YOU CARE AS I DID 	
TRUE,as far as this article goes just like most of the public school teachers I have meet are completely lacking in common sense. EDUCATED FOOLS so is the writer of the article. what parent with even a minimal amount of common sense would use their child as a pawn to better a broken system if they are able to enroll that child into a system that cares about that childs education. 	
TRUE,Sending your child to a private school is one of the best things you can do for them.  The teachers do not open up a text book and teach every child the same way.  Private teachers have more passion about teaching  because they are free to write their own curriculum for each child based on developmental assessments and achievements to where each child is learning at the level they need to be at and not just a class as a whole.  Children in the public school systems ARE left behind bullied and not challenged enough in their own learning capabilities. When your public school system ranks #50 in the nation you tell me would you rather send your child to public school or honor them with attending a private school?
TRUE,Does Allison Benedikt have children?  All my children went to public school.  But I had to move to a location in a good school district.  The location where I did live lacked good teachers and good curriculum.  Sure my children would have excelled in that school but they would never been challenged.  In the Pendleton Heights school system my children excelled and were challenged.  Parents should always have the welfare of their at the top of the list.  If that includes enrolling them in a private school so be it. That doesn't make them bad people. 	
FALSE,What a stupid article.  Must be a member of the teachers union.	
TRUE,The parents of the kids in private schools still pay the property taxes (80% goes for public schools). So in reality it’s better for the public schools less customers but still getting the same amount of money.
TRUE,so my kids should suffer for the school systems down fall while we figure it out....news flash change takes time and you only have kids in school for a short time.... 	
TRUE,Two kids in private school. Excellent education. Kids are happy. Allison.....STFU!!	
TRUE,This is absolutely the worst piece of garbage I have ever read!  We did without so we could send our kids to Catholic school.  I helped paint classrooms and wash windows.  My husband helped update plumbing.  Other parents did landscaping waxed floors supervised recess helped in the kitchen  repaired the furnace and water heater maintained the school bus and re-sealed the driveway.  This is the way it has always been done in the Catholic school system.  On top of all this we also paid taxes to the public school.  If public school parents don't like their 'crappy' school then let THEM make changes.  We have done our share. 	
TRUE,I taught in public high schools for 15 years.  My advice to parents?  Run don't walk to the nearest private school.  Public schools are not about education; they are about social engineering.  Parents had a stake in their public schools when they were neighborhood schools.  Neighborhood schools were community gathering places where parents kids and teachers all came together and all knew each other.  My high school graduating class had fewer than 50 seniors yet PTA meetings had to be held in the auditorium. One high school where I taught had almost 2000 students; what passed for PTA meetings were held in the principal's office.  The school board for my system was made up of lay people each of whom had a personal agenda that had nothing to do with education.  In 15 years I never saw a board member visit either of my two schools.  Public schools are fad driven.  Remember new math?  Of course not.  No one does.  Cooperative education?  Social advancement?  Mainstreaming?  At the Tech school where I taught seniors once had five hours of shop class in the trade they came there to learn.  Then those who ran public education decreed that every child should have a college-prep curriculum.  When I left that school seniors were lucky to have two hours of shop; the rest of the time they spent taking courses for which they had no need desire or use.  Public schools have failed at their purpose because they have lost their purpose.
TRUE,"I do support public schools with my taxes. I then send my children to a private school to instill moral behavior and God in their lives. This nation was founded ""under God"" (the pledge of allegiance). Look at all the references to God in our nations capital. The inscriptions on the Lincoln Memorial states ""this nation under God shall have a new freedom"" At the very top of the Washington monument are the words ""praise be to God"" The inscription on  the Jefferson Memorial ""God who gives us life gives us liberty"". When the President gives his State of the Union address above his head are the words ""In God We Trust"". These are just a few examples. Why is it then when in our public schools we can't mention or refer to God in any manner? 	"
FALSE,"I went to public schools in Baltimore City MD. They have consistently ranked in the bottom for decades. I currently send my own sons to public school (they have also attended private/religious schools in the past) one that is just recently improving and offering more AP courses in AZ.  I am a highly successful professional went on the earn multiple college degrees and certifications. My sons are also excelling and I could not be prouder of their efforts.  Education is a private choice but I have found that regardless of whether you attend public or private schools (I have met total losers drug addicts and criminals from BOTH public and private schools) the outcome depends on the support the parent (s) provide at home. A child will imitate mom and dad. If mom and dad are supportive educated and active in the child's progress the child will do well and go on to be successful. The school is irrelevant. These parents demanding isolation of their kids from ""the bad people"" are not helping them. To be successful in life children need exposure and interaction with all types of people different skin color religions values in order to create their own identity and be prepared for what lies ahead when they are on their own at college and future jobs. Ultimately mom and dad you are your child's compass not whatever school you choose to place them in. Take charge of your child's education you will only see good outcomes. 	"
FALSE,I don't understand why the children aren't allowed to enroll in public school. I don't have a problem with parents wanting to home school their children but once the child reaches a certain age they should be permitted to makes some decisions with regards to their schooling including attending local schools. The fact that the County refuses to do more with regards to the Powell children in spite of the evidence that their education is lacking is appalling to me. And if Mr. Powell is going to continue to educate the children at home he needs to get someone to help him. 	
FALSE,I THINK EVERY KID SHOULD BE TAUGHT GOD'S WORD EARLY WITH ONE CLASS IN BIBLE STUDY. SINCE GETTING INTO GOD'S WORD DEEPLY ABOUT 9 YEARS AGO I AM HUMBLED IN WHAT I DID NOT KNOW
FALSE,"Many of the people in this forum are citing ""Freedom of choice."" I am willing to bet those same people are the ones who want to tell me I don't have a choice when it comes to what I do with my body and who I marry. 	"
FALSE,I think all schools should be paid for.	
TRUE,"I send my child to a private school not only because they can pray and use the word ""God"" but because a private school can get rid of a bad teacher at any time. Public school teachers have a union that allows them to continue to work because they have ""X"" number of years. Public school teachers should continue to get better continue their education and be held accountable for the product that they put out. I'm certainly not a ""wealthy"" person but choose to send my child to a private school because all the parents at the school care about their child and doesn't depend on the school and the teachers to raise the child. Bad parents send their child to a public school and think they don't need to be involved with the education of their own child. Not all parents of public school kids are bad but none at a private school think that it is the schools responsibility to education the child. 	"
TRUE,PUBLIC SCHOOLS ARE LIBERALLY SLANTED AND DO NOT TEACH KIDS THE CONSTITUTION AND BILL OF RIGHTS. ALSO IF GOD IS NOT PART OF THE EQUATION YOU CAN FORGET IT. UNIONS AND THE LIBERALS DESTROY EVERYTHING THEY TOUCH EVEN EDUCATION 	
TRUE,Absolutely stupid person why do we have children? To send to an immoral government run pig farm? No but to give to our children all the best that we as parents can! 	
TRUE,"Public school systems teach ""Common Core"" a totally Socialist/communist slanted education replacing history books with books full of crap not facts. They don't teach they indoctrinate! 	"
FALSE,This is all communist-minded dribble.  Equalize everyone and everything don't dare do what's best for your kid becuase in some obscure imaginative way it might hurt the masses of people?   If this person really wants to fix public schools kick out the non-performers who don't learn anything and don't care anyway.  Focus your resources on the investments that pay off.  Divert your money away from the money pits.   Oh nevermind I'm talking to a far left communist this makes no sense to those types. 	
FALSE,"Whether parents send their kids to public or private does not impact the quality of the public school system because the school system is partially funded through real estate taxes that homeowners pay. One could look at it that families that are not homeowners don't contribute to the school system yet enjoy the services while homeowners who do pay taxes and choose to send their kids to a private school are effectively paying twice. Should they get a rebate? Labeling parents who select private schools as ""mean"" is rather juvenile but perhaps the writer is illustrating through personal example the problems with the public school systemthe inability to concisely present an argument without resorting to name-calling..... "
FALSE,Even in backwards New Mexico parents have to register that they are home schooling their children what materials they are using (there's an approved list) the students have to take the standards based assessments and the state trackes their progress. 	
TRUE,"I could care less if she thinks I am a bad parent. I have a responsibility to my Child to do the best I can for her and sending her to the public school system to be endoctronated into the ""moral standards""( or lack there of ) that the Government standards dictate is NOT what is best for her.  And We are going to do everything in our power to follow that conviction. 	"
FALSE,Simply put and resorting to childish antics of name calling which the writer of the article can understand maybeMoron. 
FALSE,You are a bad parent if you do not get your child the best education that is feasible for him/her under your circumstances.  The notion that your child(ren) should be used to indulge some social agenda is pathetic. 	
TRUE,"I am perturbed that Mr. Powell's sister claims that many of her younger siblings spend ""most of the day"" playing video games - is that educational? I strongly doubt it. Sounds to me as though Mrs. Powell is overwhelmed by having to tend to the education of at least 8 children at home and lets them do as they will. 	""A sibling who can't read by middle school? If the kid is dyslexic is he doomed because his parents won't/ don't/ can't get assistance for how to handle such a learning challenge? There needs to be some checking in on the homeschooled students' progress. ""	""Again Mr. Powell succeeds because he is motivated and very smart; his siblings may not be so motivated but they deserve to at least learn to read by age 12. Especially if they go into construction or farming - there are many permits/forms to fill out and people who cannot keep up will end up itinerant laborers - hardly what their parents intended. """
FALSE,Typical democrat!  If we just gave all of our money to the government they would know better what to do with it. We just need to rely on the people who overspend and don't care rather than focus on our own families. 	
TRUE,If you can afford private school then do it. Not only will your children receive a better education they will be exposed to far less bullying. I have four grandchildren in private school. Money well spent. 	
TRUE,So I am suppose to sacrifice my child education for the sake of the countries? It was shitty prior to her birth or mine?  I am a single mother and I make less than most people and I am sending my child to a private school.  So I guess I am a bad person! 	
